Date Time,profile,company,Location,Start Date,Stipend,Duration,Apply by Date,Offer,Education,Skills,Perks
2025-09-27 21:30:48,Recruitment,Classic International,Delhi,Immediately,"₹ 2,000 - 6,000 /month",3 Months,31 Oct' 25,Nothing,2. Ensuring all documents meet Saudi Arabia embassy/consulate requirements.,"English Proficiency (Spoken), English Proficiency (Written), MS-Excel, MS-Office","Certificate, Letter Of Recommendation"
2025-09-27 21:30:52,Content Writing,Hawk Ecommerce,Gurgaon,Immediately,"₹ 15,000 - 20,000 /month",6 Months,15 Oct' 25,Nothing,Not Specified,"Attention to Detail, Content Writing, Creative Writing, Digital Marketing, English Proficiency (Spoken), English Proficiency (Written), Proofreading, Search Engine Optimization (SEO)","Certificate, Letter Of Recommendation"
2025-09-27 21:30:54,Digital Marketing,Ocean Tech Zone,Delhi,Immediately,"₹ 6,000 - 10,000 /month",6 Months,15 Oct' 25,Nothing,Not Specified,"Facebook Ads, Search Engine Optimization (SEO), Social Media Marketing","Certificate, Letter Of Recommendation"
2025-09-27 21:30:58,Video Editing/Making,Hawk Ecommerce,Gurgaon,Immediately,"₹ 15,000 - 20,000 /month",6 Months,15 Oct' 25,Nothing,"1. Currently, pursuing or recently completed a degree in Film, Media, Communication, or a related field.","Adobe After Effects, Adobe Illustrator, Adobe Photoshop, Adobe Premiere Pro, Capcut, Final Cut Pro, Video Editing","Certificate, Letter Of Recommendation"
2025-09-27 21:31:00,Graphic Design,Hawk Ecommerce,Gurgaon,Immediately,"₹ 15,000 - 20,000 /month",6 Months,15 Oct' 25,Nothing,"1. Currently, pursuing or recently completed a degree in Graphic Design, Visual Arts, or a related field.","Adobe After Effects, Adobe Creative Suite, Adobe Illustrator, Adobe InDesign, Adobe Photoshop, Adobe Premiere Pro, CorelDRAW, Sketch","Certificate, Letter Of Recommendation"
2025-09-27 21:31:02,Briefing of DMIT to Prospective Clients and Closing the Deal,Digitus Cerebral - Branch Of Tipping Point Advisory Services,Noida,Immediately,"₹ 5,500 - 15,000 /month",3 Months,15 Oct' 25,Nothing,Not Specified,"English Proficiency (Spoken), Hindi Proficiency (Spoken)","Certificate, Flexible, Letter Of Recommendation, 5 Days A Week"
2025-09-27 21:31:06,Social Media Marketing,Make My Radio,Delhi,Immediately,"₹ 10,000 - 15,000 /month",3 Months,15 Oct' 25,Nothing,Not Specified,"Canva, ChatGPT, Digital Marketing, English Proficiency (Spoken), Social Media Marketing","Certificate, Letter Of Recommendation"
2025-09-27 21:31:08,Coordinator - HR And Ecom Operations,Portia Global,Gurgaon,Immediately,"₹ 7,000 /month",6 Months,15 Oct' 25,Nothing,Not Specified,Computer skills,Flexible
2025-09-27 21:31:11,Human Resources (HR),Hawk Ecommerce,Gurgaon,Immediately,"₹ 18,000 - 25,000 /month",6 Months,15 Oct' 25,Nothing,"1. Pursuing or recently completed a degree in Human Resources, Business Administration, Psychology, or related field","Attendance Management, Attention to Detail, English Proficiency (Spoken), English Proficiency (Written), MS-Excel, Onboarding, Presentation skills, Recruitment","Certificate, Letter Of Recommendation"
2025-09-27 21:31:13,Content and Social Media Marketing,Voyagers Beat,Delhi,Immediately,"₹ 4,000 - 8,000 /month",4 Months,15 Oct' 25,Nothing,Not Specified,"Content Editing, Social Media Marketing","Certificate, Letter Of Recommendation"
2025-09-27 21:31:17,sales,Aska Technologies,Delhi,Immediately,"₹ 20,000 - 21,000 /month",6 Months,15 Oct' 25,Nothing,"2. Bachelor’s degree in business administration, management, or a related field.","Effective Communication, Interpersonal skills","Certificate, Letter Of Recommendation, 5 Days A Week"
2025-09-27 21:31:21,Event And Database Management,Messe Stuttgart India,Delhi,Immediately,"₹ 10,000 - 12,000 /month",6 Months,15 Oct' 25,Nothing,Not Specified,"Data entry, Effective Communication, English Proficiency (Spoken), Event Management, MS-Excel, MS-Office","Certificate, Flexible, Letter Of Recommendation, 5 Days A Week"
2025-09-27 21:31:23,Logistics And Operations,Driveo Electric Mobility Private Limited,Chennai,Immediately,"₹ 15,000 /month",6 Months,15 Oct' 25,Nothing,Not Specified,Operations,Flexible
2025-09-27 21:31:25,Research (Economics),Manurut Tokas,Delhi,Immediately,"₹ 12,000 - 15,000 /month",3 Months,15 Oct' 25,Nothing,Not Specified,"Data entry, Economics, Report Writing","Certificate, Flexible, Letter Of Recommendation"
2025-09-27 21:31:29,Digital Marketing,Reliable MediaX,Ghaziabad,Immediately,"₹ 2,000 - 2,500 /month",3 Months,15 Oct' 25,Nothing,Not Specified,"Canva, Creative Writing, Digital Marketing, Email Marketing, English Proficiency (Written), Facebook Marketing, Google AdWords, Instagram Marketing","Certificate, Flexible, Letter Of Recommendation"
2025-09-27 21:31:31,Generative AI Video Editor,Hungama Digital Media Entertainment Private Limited,Noida,Immediately,"₹ 10,000 /month",3 Months,15 Oct' 25,Nothing,Not Specified,"Adobe Premiere Pro, HeyGen (GenAI)","Certificate, 5 Days A Week"
2025-09-27 21:31:37,ESG Platform Coordinator,SuperHuman Race Private Limited,Chennai,Immediately,"₹ 9,000 - 15,000 /month",6 Months,15 Oct' 25,Nothing,Not Specified,"Effective Communication, English Proficiency (Spoken), English Proficiency (Written), Problem Solving, Training and Development","Flexible, 5 Days A Week"
2025-09-27 21:31:39,Content and Social Media Marketing,Aastha Bhasin,Delhi,Immediately,"₹ 5,000 - 20,000 /month",6 Months,15 Oct' 25,Nothing,Not Specified,"Adobe Photoshop, Capcut, Content Marketing, Content Writing, Creative Direction, Creative Thinking, Design Thinking, English Proficiency (Spoken)","Certificate, Flexible, Letter Of Recommendation, Mentorship"
2025-09-27 21:31:46,Media & Public Relations (PR),ISchoolConnect Technologies India,Noida,Immediately,"₹ 20,000 - 25,000 /month",6 Months,15 Oct' 25,Nothing,Not Specified,"English Proficiency (Spoken), English Proficiency (Written), MS-Excel, Public Relations",5 Days A Week
2025-09-27 21:31:49,Marketing,Primero Charter Services,Delhi,Immediately,"₹ 10,000 - 15,000 /month",3 Months,15 Oct' 25,Nothing,Not Specified,"Digital Marketing, English Proficiency (Spoken), English Proficiency (Written), Graphic Design","Certificate, Flexible, Letter Of Recommendation"
2025-09-27 21:32:14,Travel Consultant,Hono.ai,Gurgaon,Immediately,"₹ 8,000 - 10,000 /month",6 Months,15 Oct' 25,Nothing,Not Specified,"Effective Communication, Interpersonal skills, MS-Excel, Presentation skills",Certificate
2025-09-27 21:32:17,Interior Design,A1 Home,Gurgaon,Immediately,"₹ 5,000 - 15,000 /month",3 Months,15 Oct' 25,Nothing,Not Specified,"Adobe Photoshop, AutoCAD, Autodesk 3ds Max, Google SketchUp",Not Available
2025-09-27 21:32:19,Business Development (Sales),LOM Digital Pvt Ltd,Gurgaon,Immediately,"₹ 5,000 - 15,000 /month",3 Months,15 Oct' 25,Nothing,Not Specified,"Digital Marketing, Email Marketing, English Proficiency (Spoken), English Proficiency (Written), MS-Excel","Certificate, Flexible, Letter Of Recommendation, 5 Days A Week"
2025-09-27 21:32:21,Field Operations & Content Specialist,360Ghar,Gurgaon,Immediately,"₹ 5,000 /month",2 Months,15 Oct' 25,Nothing,"2. On-site content creation: Visiting properties to record guided 360-degree video walkthroughs, capture professional photographs, and gather accurate property details (measurements, amenities, etc.).","Content Editing, Video Making","Certificate, Flexible, Letter Of Recommendation, 5 Days A Week"
2025-09-27 21:32:24,Executive Assistant,Critical Care Unified,Noida,Immediately,"₹ 10,000 - 15,000 /month",3 Months,15 Oct' 25,Nothing,Not Specified,"English Proficiency (Spoken), English Proficiency (Written), Market Analysis, Market research, MS-Excel, MS-Office, MS-PowerPoint, MS-Word",Certificate
2025-09-27 21:32:27,Digital Marketing,Kyari Resorts LLP,Gurgaon,Immediately,"₹ 6,000 - 12,000 /month",2 Months,15 Oct' 25,Nothing,Not Specified,Digital Marketing,Not Available
2025-09-27 21:32:37,Operations,Caterspoint Futuristic Foods,Delhi,Immediately,"₹ 10,000 - 15,000 /month",6 Months,31 Oct' 25,Nothing,Not Specified,"English Proficiency (Spoken), English Proficiency (Written), MS-Excel, MS-Office, MS-PowerPoint, MS-Word",Certificate
2025-09-27 21:32:43,Copywriting,Ayurveda House Private Limited,Delhi,Immediately,"₹ 10,000 - 12,000 /month",3 Months,15 Oct' 25,Nothing,Not Specified,"Copywriting, Creative Writing, English Proficiency (Written)",Certificate
2025-09-27 21:32:46,Digital Marketing,"Ureka Education Group, UK",Gurgaon,Immediately,"₹ 14,000 - 15,000 /month",3 Months,15 Oct' 25,Nothing,Not Specified,"Digital Marketing, Email Marketing, English Proficiency (Spoken), English Proficiency (Written), MS-Excel, MS-PowerPoint, Research and Analytics, Search Engine Optimization (SEO)","Certificate, Flexible, Letter Of Recommendation, 5 Days A Week"
2025-09-27 21:32:52,Project Management,"Tisteps Private Limited (Chennai, India)",Chennai,Immediately,"₹ 30,000 - 40,000 /month",6 Months,5 Nov' 25,Nothing,Not Specified,"Document Management, Effective Communication, Organizational Development, Project Management, Scheduling","Certificate, Flexible, Letter Of Recommendation, 5 Days A Week"
2025-09-27 21:32:54,Nothing,Nothing,Not Available,Not Available,Not Available,Not Available,Not Available,Nothing,Not Specified,Not Available,Not Available
2025-09-27 21:32:54,Human Resources (HR),UnivLabs,Gurgaon,Immediately,"₹ 7,000 - 9,000 /month",3 Months,24 Oct' 25,Nothing,"1. Pursuing or recently completed a degree in HR, business, psychology, or a related field.","English Proficiency (Spoken), English Proficiency (Written), Human Resource Information System (HRIS), Human Resources, MS-Excel, Onboarding, Recruitment, Talent Management","Certificate, 5 Days A Week"
2025-09-27 21:32:59,Inside Sales,Spaark Overseas,Noida,Immediately,"₹ 27,000 - 34,000 /month",4 Months,15 Oct' 25,Nothing,Not Specified,"Cold Calling, Negotiation, Sales","Certificate, Letter Of Recommendation"
2025-09-27 21:33:02,Recruitment,Gigde Global Solutions Private Limited,Noida,Immediately,"₹ 10,000 - 12,000 /month",6 Months,15 Oct' 25,Nothing,Not Specified,"English Proficiency (Spoken), English Proficiency (Written), Recruitment",Certificate
2025-09-27 21:33:03,Marketing,Bajaj Foundation,Delhi,Immediately,"₹ 8,000 - 14,000 /month",5 Months,30 Oct' 25,Nothing,Not Specified,"Email Marketing, English Proficiency (Spoken), English Proficiency (Written), MS-Office","Certificate, Letter Of Recommendation"
2025-09-27 21:33:05,Sales Associate,Stirring Minds,Delhi,Immediately,"₹ 8,000 - 12,000 /month",6 Months,16 Oct' 25,Nothing,Not Specified,"Client Relationship Management (CRM), Customer Support, MS-Excel, Sales Strategy, Sales Support","Certificate, Letter Of Recommendation, Mentorship"
2025-09-27 21:33:09,Flutter Development,Jarvis Technology & Strategy Consulting,Noida,Immediately,"₹ 15,000 - 20,000 /month",3 Months,15 Oct' 25,Nothing,Not Specified,"Dart, Flutter, Git","Certificate, Letter Of Recommendation, 5 Days A Week"
2025-09-27 21:33:11,Interior Design,Spectrum,Delhi,Immediately,"₹ 5,000 - 7,000 /month",6 Months,15 Oct' 25,Nothing,Not Specified,"Adobe Photoshop, AutoCAD, Google SketchUp",Certificate
2025-09-27 21:33:14,Event Management,Divy Power Private Limited,Ghaziabad,Immediately,"₹ 5,000 - 6,000 /month",1 Month,15 Oct' 25,Nothing,Not Specified,"Community Management, Computational Neuroscience, Effective Communication, English Proficiency (Spoken), Presentation skills, Public Speaking","Certificate, Letter Of Recommendation"
2025-09-27 21:33:16,Telecalling,Dharma Life-Gajam India Private Limited,Delhi,Immediately,"₹ 15,000 - 18,000 /month",1 Month,15 Oct' 25,Nothing,2. Graduate in any discipline,"Effective Communication, English Proficiency (Spoken), Hindi Proficiency (Spoken), MS-Excel",Certificate
2025-09-27 21:33:20,Business Development (Sales),Zulu Club,Gurgaon,Immediately,"₹ 21,000 /month",3 Months,15 Oct' 25,Nothing,Not Specified,"Branding, Community Management, Effective Communication, Field Work, Interpersonal skills, Marketing, Marketing Campaigns, Market research",Not Available
2025-09-27 21:33:25,Human Resources (HR),NayePankh Foundation,Ghaziabad,Immediately,"₹ 15,000 /month",6 Months,15 Oct' 25,Nothing,Not Specified,"English Proficiency (Spoken), English Proficiency (Written)","Certificate, Letter Of Recommendation"
2025-09-27 21:33:28,Digital Marketing,Login4ites Network,Noida,Immediately,"₹ 2,400 - 2,600 /month",3 Months,13 Oct' 25,Nothing,Not Specified,"Digital Marketing, Facebook Marketing, Instagram Marketing, Search Engine Marketing (SEM), Search Engine Optimization (SEO), Social Media Marketing","Certificate, Flexible"
2025-09-27 21:33:30,Human Resources (HR),Vetic,Gurgaon,Immediately,"₹ 15,000 /month",3 Months,13 Oct' 25,Nothing,Not Specified,"Effective Communication, English Proficiency (Spoken), English Proficiency (Written), MS-Excel, MS-Office, MS-Word, Recruitment",Letter Of Recommendation
2025-09-27 21:33:32,Content and Social Media Marketing,OG Plaanet,Noida,Immediately,"₹ 7,000 - 20,000 /month",6 Months,13 Oct' 25,Nothing,Not Specified,"Artificial intelligence, Social Media Marketing","Letter Of Recommendation, 5 Days A Week"
2025-09-27 21:33:34,Content Writing,Ayurveda House Private Limited,Delhi,Immediately,"₹ 10,000 - 12,000 /month",3 Months,13 Oct' 25,Nothing,Not Specified,"Blogging, Content Writing, English Proficiency (Spoken), English Proficiency (Written)",Certificate
2025-09-27 21:33:36,Marketing,Vsay E Solution,Gurgaon,Immediately,"₹ 7,000 - 12,000 /month",3 Months,13 Oct' 25,Nothing,Not Specified,"Creative Thinking, Digital Marketing, Effective Communication, English Proficiency (Spoken), MS-Excel, MS-Office, Social Media Marketing","Certificate, Letter Of Recommendation"
2025-09-27 21:33:38,Front End Development,TheBlackJabGroup,Gurgaon,Immediately,"₹ 10,000 - 40,000 /month",4 Months,13 Oct' 25,Nothing,Not Specified,"CSS, Git, HTML, JavaScript, Node.js, React Native, Shopify","Certificate, Flexible, Letter Of Recommendation, 5 Days A Week"
2025-09-27 21:33:40,UI/UX Design,TheBlackJabGroup,Gurgaon,Immediately,"₹ 15,000 - 40,000 /month",4 Months,13 Oct' 25,Nothing,Not Specified,"Adobe Creative Suite, Adobe Illustrator, Adobe Photoshop, Figma, Wireframing","Certificate, Flexible, Letter Of Recommendation, 5 Days A Week"
2025-09-27 21:33:45,Graphic Design,Oceedee Shoes,Delhi,Immediately,"₹ 8,000 - 12,000 /month",3 Months,13 Oct' 25,Nothing,Not Specified,"Adobe Illustrator, Adobe Photoshop","Certificate, Letter Of Recommendation"
2025-09-27 21:33:47,Media & Public Relations (PR),The News Insight,Delhi,Immediately,"₹ 5,000 - 8,000 /month",6 Months,13 Oct' 25,Nothing,Not Specified,"Content Writing, News Writing","Certificate, Flexible, Letter Of Recommendation"
2025-09-27 21:33:57,AI Video And Content Creator,Electrostatclean Solutions,Ghaziabad,Immediately,"₹ 5,000 - 10,000 /month",6 Months,13 Oct' 25,Nothing,Not Specified,Video Editing,"Certificate, Letter Of Recommendation"
2025-09-27 21:33:59,Marketing,DU Express,Delhi,Immediately,"₹ 5,000 - 10,000 /month",3 Months,13 Oct' 25,Nothing,"2.      Relationship Builder: Manage vendors, clients, and student communities like a pro.","English Proficiency (Spoken), English Proficiency (Written), Influencer Marketing, Social Media Marketing","Certificate, Flexible, Letter Of Recommendation"
2025-09-27 21:34:27,Media & Public Relations (PR),Startup Reporter,Delhi,Immediately,"₹ 5,000 - 7,000 /month",3 Months,13 Oct' 25,Nothing,Not Specified,"Creative Writing, Effective Communication, English Proficiency (Spoken), English Proficiency (Written), Market Analysis, Market research, Social Media Marketing","Certificate, Flexible, 5 Days A Week"
2025-09-27 21:34:32,Video Content Creator,Dhwani Astro,Delhi,Immediately,"₹ 12,000 - 18,000 /month",6 Months,13 Oct' 25,Nothing,Not Specified,"Collaboration, Creative Thinking, Creativity, Research and Analytics, Script Writing, Social Media Marketing, Storytelling, Time Management","Certificate, Letter Of Recommendation"
2025-09-27 21:34:35,Interior Design,UrbanCrafts,Noida,Immediately,"₹ 8,000 - 10,000 /month",6 Months,13 Oct' 25,Nothing,Not Specified,"Adobe Photoshop, AutoCAD, Interior design",Not Available
2025-09-27 21:34:38,Digital Marketing,Vserv Capital Services,Gurgaon,Immediately,"₹ 10,000 - 15,000 /month",3 Months,13 Oct' 25,Nothing,Not Specified,"Creative Writing, Digital Marketing, Email Marketing, Facebook Marketing, Instagram Marketing, Search Engine Optimization (SEO), Social Media Marketing","Certificate, Flexible"
2025-09-27 21:34:43,Graphic Design,Mify Solutions Private Limited,Delhi,Immediately,"₹ 10,000 - 15,000 /month",3 Months,13 Oct' 25,Nothing,Not Specified,"Adobe Illustrator, Adobe Photoshop, Canva, CorelDRAW, Figma, Image Editing, UI & UX Design, Video Editing",Certificate
2025-09-27 21:34:48,Human Resources (HR),Outright Systems Private Limited,Delhi,Immediately,"₹ 5,000 - 10,000 /month",4 Months,15 Oct' 25,Nothing,Not Specified,"Administrative Support, Document Management, Employment engagement, English Proficiency (Spoken), English Proficiency (Written), HR Operations, Human Resources, MS-Office","Certificate, 5 Days A Week"
2025-09-27 21:34:52,Fashion Design And Merchandising,Lanos Yvvas (Essel Enterprises),Delhi,Immediately,"₹ 2,500 - 5,000 /month",4 Months,13 Oct' 25,Nothing,Not Specified,"Adobe Photoshop, CLO3D, CorelDRAW","Certificate, Flexible, Letter Of Recommendation"
2025-09-27 21:34:57,Digital Marketing,Smartmovess Consulting Zone,Delhi,Immediately,"₹ 4,000 - 5,000 /month",6 Months,13 Oct' 25,Nothing,Not Specified,"Digital Marketing, English Proficiency (Written), Search Engine Marketing (SEM), Search Engine Optimization (SEO), Social Media Marketing","Certificate, Letter Of Recommendation"
2025-09-27 21:35:02,Business Strategy,Property Spotters,Gurgaon,Immediately,"₹ 10,000 - 12,000 /month",2 Months,13 Oct' 25,Nothing,Not Specified,"Data Analysis, English Proficiency (Spoken), English Proficiency (Written), MS-Excel, MS-PowerPoint, Research and Analytics, Strategy","Certificate, Letter Of Recommendation, 5 Days A Week"
2025-09-27 21:35:04,Design,Microtex Processors Private Limited,Delhi,Immediately,"₹ 7,000 - 25,000 /month",2 Months,13 Oct' 25,Nothing,Not Specified,"Adobe Illustrator, Adobe Photoshop, CorelDRAW, Fashion Designing","Certificate, Flexible, Letter Of Recommendation, 5 Days A Week"
2025-09-27 21:35:07,Operations,PlanCover,Gurgaon,Immediately,"₹ 5,000 - 10,000 /month",6 Months,13 Oct' 25,Nothing,Not Specified,Advanced Excel,Not Available
2025-09-27 21:35:09,Talent Acquisition,Agrim Wholsesale Private Limited,Gurgaon,Immediately,"₹ 10,001 - 25,002 /month",4 Months,13 Oct' 25,Nothing,Not Specified,"English Proficiency (Spoken), MS-Excel","Certificate, Letter Of Recommendation"
2025-09-27 21:35:12,Sales and Marketing,Golden Brick Radix Private Limited,Gurgaon,Immediately,"₹ 20,000 - 75,000 /month",3 Months,13 Oct' 25,Nothing,Not Specified,"Business Development, Client Interaction, Customer Support, Effective Communication, English Proficiency (Spoken), Lead Generation, Sales","Certificate, Letter Of Recommendation"
2025-09-27 21:35:13,Marketing,GMO GlobalSign,Delhi,Immediately,"₹ 11,000 - 12,000 /month",6 Months,13 Oct' 25,Nothing,"1. Students or recent graduates interested in marketing, sales, or business development.","Cold Calling, Email Marketing, English Proficiency (Spoken), Lead Generation, MS-Excel, MS-Office","Certificate, Flexible, Letter Of Recommendation, 5 Days A Week"
2025-09-27 21:35:16,Content and Social Media Marketing,Sky Architects,Gurgaon,Immediately,"₹ 10,000 - 30,000 /month",6 Months,13 Oct' 25,Nothing,Not Specified,"Google AdWords, Instagram Marketing","Certificate, Flexible, Letter Of Recommendation, 5 Days A Week"
2025-09-27 21:35:20,Inside Sales,Stirring Minds,Delhi,Immediately,"₹ 28,000 - 36,000 /month",6 Months,13 Oct' 25,Nothing,Not Specified,"Business Development, Client Interaction, Client Relationship, Customer Acquisition, Effective Communication, Sales, Sales Support","Certificate, Mentorship"
2025-09-27 21:35:22,Business Development (Sales),Stirring Minds,Delhi,Immediately,"₹ 8,000 - 12,000 /month",6 Months,13 Oct' 25,Nothing,Not Specified,"Business Development, Client Interaction, Client Relationship, Customer Acquisition, Customer Support, English Proficiency (Spoken), Marketing, MS-Excel","Certificate, Mentorship"
2025-09-27 21:35:30,Human Resources (HR),GoMechanic,Gurgaon,Immediately,"₹ 10,000 /month",3 Months,13 Oct' 25,Nothing,Not Specified,"Effective Communication, English Proficiency (Spoken), English Proficiency (Written), MS-Excel, Recruitment, Time Management","Certificate, Letter Of Recommendation"
2025-09-27 21:35:32,Nothing,Nothing,Not Available,Not Available,Not Available,Not Available,Not Available,Nothing,Not Specified,Not Available,Not Available
2025-09-27 21:35:32,Digital Marketing,BMKP Festiverse Private Limited,Noida,Immediately,"₹ 4,000 /month",4 Months,13 Oct' 25,Nothing,Not Specified,"Digital Marketing, English Proficiency (Written), Facebook Marketing, Instagram Marketing, Search Engine Marketing (SEM), Search Engine Optimization (SEO), Social Media Marketing","Certificate, Letter Of Recommendation"
2025-09-27 21:35:34,Photography,Vayu Atelier,Delhi,Immediately,"₹ 2,000 - 3,000 /month",6 Months,13 Oct' 25,Nothing,Not Specified,"Adobe Photoshop, Adobe Photoshop Lightroom CC, Photography, Video Making",Not Available
2025-09-27 21:35:37,Video Editing/Making,Kodeclamp Private Limited,Noida,Immediately,"₹ 15,000 /month",6 Months,12 Oct' 25,Nothing,"1. Students or recent graduates with a passion for videography, digital storytelling, and content creation.","Adobe Photoshop, Adobe Premiere Pro, Photography, Video Editing, Video Making","Certificate, Flexible, Letter Of Recommendation, 5 Days A Week"
2025-09-27 21:35:39,Human Resources (HR),Cars24 Services Private Limited,Gurgaon,Immediately,"₹ 12,000 - 15,000 /month",6 Months,12 Oct' 25,Nothing,1. Currently pursuing or recently completed a degree in human resources or business administration,"Canva, English Proficiency (Spoken), HR Operations, HR Policies, MS-Office, Talent Management, Training and Development","Certificate, 5 Days A Week"
2025-09-27 21:35:41,Copywriting,GrowthSpree,Delhi,Immediately,"₹ 10,000 - 15,000 /month",6 Months,12 Oct' 25,Nothing,Not Specified,"Content Marketing, Copywriting, Creative Writing, English Proficiency (Spoken), English Proficiency (Written), Marketing","Certificate, 5 Days A Week"
2025-09-27 21:35:43,Backend Executive,Wave Visas,Delhi,Immediately,"₹ 6,000 - 8,000 /month",3 Months,12 Oct' 25,Nothing,Not Specified,"Attention to Detail, Content Writing",Certificate
2025-09-27 21:35:45,Creative Media Design – GTM,Flip Funnel,Gurgaon,Immediately,"₹ 12,000 - 20,000 /month",3 Months,12 Oct' 25,Nothing,"1. You’re studying or have just graduated in design, media, or communications.","Adobe Creative Suite, Canva, Capcut, Descriptive Statistics, Figma","Certificate, Flexible, Letter Of Recommendation, Mentorship, 5 Days A Week"
2025-09-27 21:35:47,Architecture,Data Alt Dynamics,Delhi,Immediately,"₹ 10,000 - 11,000 /month",6 Months,12 Oct' 25,Nothing,Not Specified,"AutoCAD, Autodesk Revit, Google SketchUp, Rhino","Certificate, Letter Of Recommendation, Mentorship, 5 Days A Week"
2025-09-27 21:35:49,Digital Marketing,Gary Global Solutions,Noida,Immediately,"₹ 8,000 - 10,000 /month",6 Months,12 Oct' 25,Nothing,Not Specified,"Search Engine Optimization (SEO), Social Media Marketing",Not Available
2025-09-27 21:35:51,Event Management,Divy Power Private Limited,Ghaziabad,Immediately,"₹ 5,000 - 6,000 /month",1 Month,12 Oct' 25,Nothing,Not Specified,"Community Management, Computational Neuroscience, Effective Communication, English Proficiency (Spoken), Presentation skills, Public Speaking","Certificate, Letter Of Recommendation"
2025-09-27 21:35:53,Digital Marketing,Nolta India Private Limited,Pitampura,Immediately,"₹ 10,000 - 12,000 /month",1 Month,12 Oct' 25,Nothing,Not Specified,"Creative Writing, Digital Marketing, Email Marketing, English Proficiency (Spoken), English Proficiency (Written), Facebook Marketing, Instagram Marketing, Search Engine Marketing (SEM)","Certificate, Flexible, Letter Of Recommendation, 5 Days A Week"
2025-09-27 21:35:55,Content and Social Media Marketing,Ruchicaz Overseas,Noida,Immediately,"₹ 10,000 - 25,000 /month",6 Months,12 Oct' 25,Nothing,Not Specified,"Adobe Photoshop, Canva, Facebook Marketing, Fashion Designing, Fashion Styling, Instagram Marketing, Social Media Marketing, Web Design","Certificate, Flexible, Letter Of Recommendation"
2025-09-27 21:35:58,Digital Marketing,Ipas Development Foundation,Delhi,Immediately,"₹ 10,000 - 15,000 /month",1 Month,12 Oct' 25,Nothing,Not Specified,"A/B Testing, Google AdWords, Google Analytics, Graphic Design, Search Engine Optimization (SEO)","Certificate, Flexible"
2025-09-27 21:36:00,Cinematography,Framo Films,Gurgaon,Immediately,"₹ 3,000 - 3,500 /month",2 Months,12 Oct' 25,Nothing,Not Specified,"Adobe Premiere Pro, Image Editing, Video Editing",Certificate
2025-09-27 21:36:01,Research Support For Various Projects,Udayan Care,Delhi,Immediately,Unpaid,2 weeks ago,12 Oct' 25,Nothing,Not Specified,"Data Cleaning, English Proficiency (Spoken), English Proficiency (Written), Hindi Proficiency (Spoken), Hindi Proficiency (Written), Research and Analytics","Certificate, Flexible, Letter Of Recommendation"
2025-09-27 21:36:03,Content Writing,Exotic India Art Private Limited,Delhi,Immediately,"₹ 5,000 - 7,000 /month",3 Months,12 Oct' 25,Nothing,1. Bachelor’s degree preferred in a relevant field.,"Blogging, Creative Writing, English Proficiency (Written)","Certificate, Letter Of Recommendation"
