Date Time,profile,company,Location,Start Date,Stipend,Duration,Apply by Date,Offer,Education,Skills,Perks
2025-09-27 21:08:52,Accountant,Traincape Technology,Delhi,Immediately,"₹ 5,000 - 5,001 /month",3 Months,24 Oct' 25,Nothing,Not Specified,"Accounting, Data Analysis, Data entry, MS-Excel","Certificate, Letter Of Recommendation"
2025-09-27 21:08:53,Educational Consultant,Digigrove Digital Pvt Ltd,Gurgaon,Immediately,"₹ 35,000 - 60,000 /month",6 Months,24 Oct' 25,Nothing,"1. Provide professional guidance to students and parents regarding various educational courses, institutions, and career options.","Effective Communication, Interpersonal skills, Problem Solving","Certificate, Flexible"
2025-09-27 21:09:04,Marketing,Stirring Minds,Delhi,Immediately,"₹ 6,000 - 12,000 /month",6 Months,24 Oct' 25,Nothing,Not Specified,"Facebook Ads, Google AdWords, Marketing Automation, Marketing Campaigns, Marketing Strategy, Social Media Marketing","Certificate, Mentorship"
2025-09-27 21:09:11,Accounts,Cedrus Silicone,Delhi,Immediately,"₹ 10,000 - 12,000 /month",3 Months,24 Oct' 25,Nothing,Not Specified,"Accounting, English Proficiency (Spoken), English Proficiency (Written), MS-Excel, MS-Office, Tally","Certificate, Flexible, Letter Of Recommendation, 5 Days A Week"
2025-09-27 21:09:14,Content Writing,Wedding Banquets,Delhi,Immediately,"₹ 8,000 - 10,000 /month",3 Months,24 Oct' 25,Nothing,Not Specified,"Blogging, Content Writing, Creative Writing","Certificate, Letter Of Recommendation"
2025-09-27 21:09:17,Acting,Rohit Sharma,Delhi,Immediately,"₹ 4,000 - 5,000 /month",1 Month,23 Oct' 25,Nothing,Not Specified,Acting Audition,Flexible
2025-09-27 21:09:20,Event Management,Aawas Yojana,Dehradun,Immediately,"₹ 10,000 - 31,000 /month",6 Months,31 Oct' 25,Nothing,Not Specified,"English Proficiency (Spoken), English Proficiency (Written)","Certificate, Flexible, Letter Of Recommendation"
2025-09-27 21:09:22,Human Resources (HR),So Delhi,Gurgaon,Immediately,"₹ 5,000 - 7,000 /month",3 Months,23 Oct' 25,Nothing,Not Specified,"Effective Communication, English Proficiency (Spoken), Human Resources, MS-Excel, MS-Office","Certificate, Letter Of Recommendation, 5 Days A Week"
2025-09-27 21:09:25,Business Development (Sales),Wildnet Technologies Private Limited,Noida,Immediately,"₹ 12,000 - 15,000 /month",6 Months,23 Oct' 25,Nothing,Not Specified,English Proficiency (Written),"Certificate, Flexible, Letter Of Recommendation, 5 Days A Week"
2025-09-27 21:09:29,Apprentice - Technology Associate,ETS India Private Limited,Gurgaon,Immediately,"₹ 15,000 - 18,000 /month",6 Months,23 Oct' 25,Nothing,2. Possess a B.Tech in computer science or IT as specified under the Apprenticeship Act.,MS-Office,"Certificate, Letter Of Recommendation, 5 Days A Week"
2025-09-27 21:09:32,Graphic Design,The Scroll Studio,Delhi,Immediately,"₹ 2,000 - 4,000 /month",2 Months,23 Oct' 25,Nothing,Not Specified,"Adobe Photoshop Lightroom CC, Canva, Content Editing, Creative Thinking, Creative Writing","Certificate, Flexible, Letter Of Recommendation"
2025-09-27 21:09:34,Architecture,ORB Design Services Private Limited,Delhi,Immediately,"₹ 5,000 - 15,000 /month",3 Months,23 Oct' 25,Nothing,Not Specified,"Adobe Photoshop, AutoCAD, Google SketchUp, MS-Office","Certificate, Flexible, Letter Of Recommendation, 5 Days A Week"
2025-09-27 21:09:36,Content and Social Media Marketing,Giftcarnation,Delhi,Immediately,"₹ 4,000 - 7,000 /month",6 Months,23 Oct' 25,Nothing,Not Specified,"Content Editing, Content Marketing, Content Writing, Search Engine Optimization (SEO), Social Media Marketing","Certificate, Flexible, Letter Of Recommendation, 5 Days A Week"
2025-09-27 21:09:39,Social Media Marketing,Reela By Vani & Varnika,Delhi,Immediately,"₹ 5,000 /month",6 Months,23 Oct' 25,Nothing,Not Specified,"Digital Marketing, English Proficiency (Spoken), English Proficiency (Written), Facebook Marketing, Instagram Marketing, Social Media Marketing","Certificate, Flexible, Letter Of Recommendation, 5 Days A Week"
2025-09-27 21:09:43,Graphic Design,Shipsy,Gurgaon,Immediately,"₹ 25,000 - 30,000 /month",6 Months,23 Oct' 25,Nothing,Not Specified,"Adobe After Effects, Adobe Creative Suite, Adobe Illustrator, Adobe Photoshop, UI & UX Design","Flexible, 5 Days A Week"
2025-09-27 21:09:45,Data Entry,Deepalaya,Delhi,Immediately,Unpaid,1 Month,23 Oct' 25,Nothing,Not Specified,"MS-Excel, MS-Office","Certificate, 5 Days A Week"
2025-09-27 21:09:47,Event Management,Messe Stuttgart India,Delhi,Immediately,"₹ 10,000 - 12,000 /month",4 Months,23 Oct' 25,Nothing,Not Specified,"Community Management, English Proficiency (Spoken), Event Management, MS-Excel, MS-Office","Letter Of Recommendation, 5 Days A Week"
2025-09-27 21:09:50,Accounting & Taxation,DK GUPTA,Delhi,Immediately,"₹ 5,000 - 10,000 /month",2 Months,23 Oct' 25,Nothing,Not Specified,MS-Excel,"Certificate, Flexible, Letter Of Recommendation"
2025-09-27 21:09:53,Video Editing/Making,JUNOON KIDS TV,Delhi,Immediately,"₹ 7,000 - 15,000 /month",3 Months,23 Oct' 25,Nothing,Not Specified,"Adobe After Effects, Adobe Photoshop, Adobe Premiere Pro, Final Cut Pro, Video Editing","Certificate, Flexible, Letter Of Recommendation"
2025-09-27 21:09:58,Data Entry,CoverYou,Gurgaon,Immediately,"₹ 8,000 - 10,000 /month",3 Months,23 Oct' 25,Nothing,1. Students/recent graduates looking for internship opportunities.,"Computer skills, Effective Communication, English Proficiency (Spoken), English Proficiency (Written), Microsoft 365, MS-Excel, MS-Office, Operations",Certificate
2025-09-27 21:10:01,Program & Research,Santhigiri Institute For Skill Development,Delhi,Immediately,"₹ 10,000 - 15,000 /month",6 Months,23 Oct' 25,Nothing,Not Specified,"Microsoft 365, Microsoft Project, MS-Excel, MS-PowerPoint, Qualitative Research, Quantitative Research, Research and Analytics","Certificate, Letter Of Recommendation"
2025-09-27 21:10:04,Content and Social Media Marketing,Mmirava,Noida,Immediately,"₹ 2,000 - 5,000 /month",6 Months,23 Oct' 25,Nothing,Not Specified,"Adobe Photoshop, Canva, Instagram Marketing","Certificate, Flexible, Letter Of Recommendation, 5 Days A Week"
2025-09-27 21:10:07,Digital Marketing,OL Tech Solutions,Noida,Immediately,"₹ 6,000-10,000 /month",3 Months,23 Oct' 25,Nothing,Not Specified,"Creative Writing, Digital Marketing, Email Marketing, English Proficiency (Spoken), English Proficiency (Written), Facebook Marketing, Instagram Marketing, Search Engine Marketing (SEM)","Certificate, Letter Of Recommendation"
2025-09-27 21:10:10,Content and Social Media Marketing,Cinemalt,Gurgaon,Immediately,"₹ 4,000 - 10,000 /month",6 Months,25 Oct' 25,Nothing,Not Specified,"Creativity, Social Media Marketing","Certificate, Flexible"
2025-09-27 21:10:20,Video Editing/Making,FEELER MEDIA,Gurgaon,Immediately,"₹ 6,000 - 10,000 /month",3 Months,23 Oct' 25,Nothing,Not Specified,"Adobe Premiere Pro, Video Editing, Video Making","Certificate, Flexible, Letter Of Recommendation, 5 Days A Week"
2025-09-27 21:10:24,Content and Social Media Marketing,Wandermonks,Delhi,Immediately,"₹ 9,000 - 17,000 /month",3 Months,23 Oct' 25,Nothing,Not Specified,"Adobe Photoshop, Adobe Photoshop Lightroom CC, Canva, Content Editing, Content Writing, English Proficiency (Written), Instagram Marketing, Social Media Marketing","Certificate, Letter Of Recommendation, 5 Days A Week"
2025-09-27 21:10:26,sales,My Wall,Gurgaon,Immediately,"₹ 10,000 - 15,000 /month",3 Months,23 Oct' 25,Nothing,Not Specified,"B2B Sales, Client Interaction, Effective Communication, Onboarding","Letter Of Recommendation, 5 Days A Week"
2025-09-27 21:10:28,Content and Social Media Marketing,Pooja Bali,Gurgaon,Immediately,"₹ 16,000 - 23,000 /month",4 Months,23 Oct' 25,Nothing,Not Specified,"Adobe Photoshop, Canva",Letter Of Recommendation
2025-09-27 21:10:29,Full Stack Development,Web3Task,Delhi,Immediately,"₹ 5,500 - 11,000 /month",3 Months,23 Oct' 25,Nothing,Not Specified,"CSS, HTML, JavaScript, MongoDB, MySQL, Node.js, PHP, React","Certificate, Flexible, Letter Of Recommendation"
2025-09-27 21:10:31,Nothing,Nothing,Not Available,Not Available,Not Available,Not Available,Not Available,Nothing,Not Specified,Not Available,Not Available
2025-09-27 21:10:31,Content and Social Media Marketing,GTB Matters,Delhi,Immediately,"₹ 5,000 - 10,000 /month",3 Months,23 Oct' 25,Nothing,Not Specified,"Adobe After Effects, Canva, Influencer Marketing, Social Media Marketing, Video Editing","Certificate, Flexible, Letter Of Recommendation"
2025-09-27 21:10:35,Business Development (Sales),WeAddo,Gurgaon,Immediately,"₹ 9,000 - 10,000 /month",6 Months,23 Oct' 25,Nothing,Not Specified,"Effective Communication, English Proficiency (Spoken), Sales","Certificate, Letter Of Recommendation, Mentorship, 5 Days A Week"
2025-09-27 21:10:38,Design – Hospitality Equipment & Omakase Project,HAKS,Delhi,Immediately,"₹ 10,000 - 12,000 /month",2 Months,23 Oct' 25,Nothing,"1. Students pursuing architecture, interior design, or product design (final year or recent graduates preferred)","AutoCAD, Google SketchUp, Rhino","Certificate, Flexible, Letter Of Recommendation"
2025-09-27 21:10:41,Social Media Marketing,Mify Solutions Private Limited,Ghaziabad,Immediately,"₹ 7,000 - 10,000 /month",2 Months,23 Oct' 25,Nothing,Not Specified,"Adobe Photoshop, Canva, Capcut, Social Media Marketing",Certificate
2025-09-27 21:10:43,Angular Development,Jogaz Info Private Limited,Delhi,Immediately,"₹ 5,000 /month",6 Months,23 Oct' 25,Nothing,Not Specified,"Angular, Angular 7.0, APIs, Git, HTTP, JavaScript, Model View Controller(MVC), REST API","Certificate, Letter Of Recommendation"
2025-09-27 21:10:47,Flutter Development,AGOMUC PROGRAM PRIVATE LIMITED,Delhi,Immediately,"₹ 2,000 /month",6 Months,23 Oct' 25,Nothing,Not Specified,"Android, Cloud Firestore, Dart, Firebase, Firebase Cloud Messaging, Flutter, Google Cloud Platforms (GCP), iOS","Certificate, Flexible, Letter Of Recommendation, 5 Days A Week"
2025-09-27 21:10:50,sales,Foundation For Learning Technologies,Gurgaon,Immediately,"₹ 5,500 /month",3 Months,23 Oct' 25,Nothing,Not Specified,"Interpersonal skills, Networking, Sales, Sales Strategy","Flexible, Letter Of Recommendation, 5 Days A Week"
2025-09-27 21:10:53,Research & Content,Diksha Sharma,Noida,Immediately,"₹ 4,000 - 5,000 /month",3 Months,23 Oct' 25,Nothing,Not Specified,"English Proficiency (Spoken), English Proficiency (Written), Google Sheets, MS-Excel, MS-Office",Certificate
2025-09-27 21:10:55,E-Commerce Catalog Management,FarmLokal,Noida,Immediately,"₹ 5,000 - 12,000 /month",3 Months,23 Oct' 25,Nothing,Not Specified,"E-commerce, MS-Excel, Product Management","Certificate, Letter Of Recommendation"
2025-09-27 21:11:01,Front Desk Executive,Omansh Gautam,Ghaziabad,Immediately,"₹ 5,500 - 8,000 /month",3 Months,23 Oct' 25,Nothing,"2. Greet parents, visitors, and students with a polite and welcoming attitude.","Computer skills, Effective Communication, Interpersonal skills, Problem Solving","Certificate, Letter Of Recommendation"
2025-09-27 21:11:03,Campus Ambassador,Hot Or Not,Delhi,Immediately,Not Available,4 Months,23 Oct' 25,Nothing,1. Certificate + official YRAL Ambassador badge for your resume,"AI Video Generation, Effective Communication","Certificate, Flexible, Letter Of Recommendation, 5 Days A Week"
2025-09-27 21:11:05,Unity Developer,Monkhub,Gurgaon,Immediately,"₹ 10,000 /month",6 Months,23 Oct' 25,Nothing,Not Specified,"Animation, Blender 3D, Unity Engine","Certificate, Flexible, Letter Of Recommendation, 5 Days A Week"
2025-09-27 21:11:08,Full Stack Development,Digital Guruji,Delhi,Immediately,"₹ 15,000 /month",6 Months,23 Oct' 25,Nothing,Not Specified,"CSS, Express.js, HTML, JavaScript, MongoDB, Node.js","Certificate, Flexible, Letter Of Recommendation"
2025-09-27 21:11:14,Human Resources (HR),SETTGO KITCHENS & CONSULTING PRIVATE LIMITED,Delhi,Immediately,"₹ 5,000 - 10,000 /month",3 Months,23 Oct' 25,Nothing,Not Specified,"English Proficiency (Written), MS-Excel","Certificate, Letter Of Recommendation"
2025-09-27 21:11:17,Software Development,Optima Learn,Noida,Immediately,"₹ 8,000 - 10,000 /month",3 Months,23 Oct' 25,Nothing,Not Specified,"CSS, Firebase, HTML, JavaScript, Next.js, Node.js, React, TypeScript","Certificate, Flexible, 5 Days A Week"
2025-09-27 21:11:19,Telecalling,Ebslon Infotech,Delhi,Immediately,"₹ 10,000 - 11,000 /month",6 Months,23 Oct' 25,Nothing,Not Specified,Effective Communication,Certificate
2025-09-27 21:11:22,Social Media Marketing,Goodweeks Tourism Private Limited,Delhi,Immediately,"₹ 5,000 - 15,000 /month",3 Months,23 Oct' 25,Nothing,Not Specified,Social Media Marketing,"Certificate, Letter Of Recommendation, 5 Days A Week"
2025-09-27 21:11:25,Digital Marketing,ICreatives Solutions,Delhi,Immediately,"₹ 16,000 - 20,000 /month",3 Months,22 Oct' 25,Nothing,"1. Fresh graduates or final-semester students from marketing, mass communication, or business backgrounds.","Digital Marketing, Lead Generation, Market research, Search Engine Optimization (SEO), Social Media Marketing",Certificate
2025-09-27 21:11:28,Sales and Marketing,Sahas Global Safety,Ghaziabad,Immediately,"₹ 12,000 - 15,000 /month",3 Months,22 Oct' 25,Nothing,1. Graduate degree in any field,"Adaptability, Collaboration, Computer skills, Effective Communication, Lead Generation, Marketing, Problem Solving, Sales",Certificate
2025-09-27 21:11:30,Content and Social Media Marketing,Green Lobby Enterprises Private Limited,Faridabad,Immediately,"₹ 5,000 - 10,000 /month",3 Months,22 Oct' 25,Nothing,Not Specified,"Videography, Video Making, Video Marketing",Certificate
2025-09-27 21:11:34,Digital Marketing & Sales,Sorditcon Private Limited,Delhi,Immediately,"₹ 6,000 - 23,000 /month",6 Months,22 Oct' 25,Nothing,Not Specified,"Digital Marketing, Effective Communication","Certificate, Flexible, Letter Of Recommendation, 5 Days A Week"
2025-09-27 21:11:38,Digital Marketing,Ichelon Consulting Group,Gurgaon,Immediately,"₹ 12,000 - 15,000 /month",3 Months,22 Oct' 25,Nothing,"5. Bachelor’s degree (pursuing or completed) in marketing, business, communications, or a related field.","Facebook Ads, Google AdWords, Lead Generation, LinkedIn Ads, Marketing Campaigns","Certificate, 5 Days A Week"
2025-09-27 21:11:40,Tech,STARTUP SQUAD PRIVATE LIMITED,Gurgaon,Immediately,"₹ 7,500 - 15,000 /month",6 Months,22 Oct' 25,Nothing,Not Specified,"JavaScript, Python","Certificate, Letter Of Recommendation"
2025-09-27 21:11:42,Equity Research Video Creator,Future Lab Studio LLP,Gurgaon,Immediately,"₹ 10,000 /month",1 Month,22 Oct' 25,Nothing,Not Specified,Equity Research,"Certificate, Flexible, Letter Of Recommendation, 5 Days A Week"
2025-09-27 21:11:44,Social Media Marketing,Varnika Arora,Delhi,Immediately,"₹ 5,000 /month",6 Months,22 Oct' 25,Nothing,Not Specified,"Creative Writing, English Proficiency (Spoken), English Proficiency (Written), Instagram Marketing, Photography, Social Media Marketing, Video Editing","Certificate, Flexible, Letter Of Recommendation, 5 Days A Week"
2025-09-27 21:11:47,Research & Insights,Caarya,Chennai,Immediately,"₹ 7,000 - 15,000 /month",2 Months,22 Oct' 25,Nothing,Not Specified,"Attention to Detail, Email Management, Google Sheets, Lead Generation, MS-Excel, Research and Analytics, Sales Strategy","Certificate, Flexible, Letter Of Recommendation"
2025-09-27 21:11:49,HR,Cars24 Services Private Limited,Gurgaon,Immediately,"₹ 10,000 - 15,000 /month",3 Months,22 Oct' 25,Nothing,Not Specified,"Onboarding, Recruitment, Talent Management","Certificate, 5 Days A Week"
2025-09-27 21:11:51,Business Development (Sales),Vikas Kumar,Faridabad,Immediately,"₹ 7,000 - 14,000 /month",6 Months,22 Oct' 25,Nothing,Not Specified,"Digital Marketing, Email Marketing, English Proficiency (Spoken), English Proficiency (Written), MS-Excel, Social Media Marketing","Certificate, Flexible, Letter Of Recommendation, 5 Days A Week"
2025-09-27 21:11:54,HR,Signature Sattva Infratech Pvt Ltd,Delhi,Immediately,"₹ 10,000 - 15,000 /month",6 Months,22 Oct' 25,Nothing,Not Specified,"English Proficiency (Spoken), English Proficiency (Written), HR Operations, Human Resource Information System (HRIS), MS-Excel, Recruitment, Statutory compliances","Certificate, Letter Of Recommendation"
2025-09-27 21:11:57,Product Interface Developer,Dofin Tech Private Limited,Gurgaon,Immediately,"₹ 11,000 - 15,000 /month",6 Months,22 Oct' 25,Nothing,Not Specified,"CSS, GitHub, HTML, Next.js, React, React Native, UI & UX Design","Certificate, Flexible, Letter Of Recommendation"
2025-09-27 21:12:11,Strategy,Innovist,Gurgaon,Immediately,"₹ 15,000 - 20,000 /month",3 Months,22 Oct' 25,Nothing,Not Specified,"Critical thinking, Management, Operations, Problem Solving",Certificate
2025-09-27 21:12:14,Sales & Marketing Research,Whistling Angles,Delhi,2. can start the internship between 19th Oct'25 and 21st Oct'25,"₹ 3,000 - 5,000 /month",3 Months,19 Oct - 21 Oct' 25,Nothing,1. Students or freshers looking to gain hands-on experience in marketing,"Market research, MS-Excel, MS-Word, Sales Strategy","Certificate, Flexible, 5 Days A Week"
2025-09-27 21:12:18,Business Development (Sales),SheWings Healthcare Private Limited,Noida,Immediately,"₹ 5,000 - 8,000 /month",3 Months,22 Oct' 25,Nothing,"1. Bachelor's degree in management with specialization in program/ project management, technology management, marketing, business analytics, or related field.","Client Interaction, Client Relationship, English Proficiency (Spoken), Lead Generation, Sales, Sales Strategy","Certificate, Letter Of Recommendation"
2025-09-27 21:12:21,Graphic Design,Ayurveda House Private Limited,Delhi,Immediately,"₹ 8,000 - 10,000 /month",3 Months,22 Oct' 25,Nothing,Not Specified,"Adobe Illustrator, Adobe InDesign, Adobe Photoshop, Adobe Premiere Pro, CorelDRAW",Certificate
2025-09-27 21:12:24,Sales and Marketing,DOTNOVA AITECH PRIVATE LIMITED,Gurgaon,Immediately,"₹ 4,999 - 5,000 /month",3 Months,22 Oct' 25,Nothing,Not Specified,"Client Interaction, Effective Communication","Certificate, Letter Of Recommendation, 5 Days A Week"
2025-09-27 21:12:27,Mathematics and Computing,FinFluence,Noida,Immediately,"₹ 9,000 - 12,500 /month",6 Months,22 Oct' 25,Nothing,Not Specified,"Algorithms, Data Analytics, Mathematics, Problem Solving, Quantitative Research, Statistical Modeling, Statistics, Stock Trading","Certificate, Letter Of Recommendation, 5 Days A Week"
2025-09-27 21:12:28,Event Management,Xeel Events,Pitampura,Immediately,"₹ 3,500 - 10,000 /month",6 Months,22 Oct' 25,Nothing,Not Specified,"Client Relationship, English Proficiency (Spoken), English Proficiency (Written), Event Management, MS-Excel, MS-Office, MS-PowerPoint","Certificate, Flexible, Letter Of Recommendation"
2025-09-27 21:12:30,Social Media Marketing,Socionaut Media,Delhi,Immediately,"₹ 7,000 - 10,000 /month",3 Months,22 Oct' 25,Nothing,Not Specified,"Content Writing, Creative Writing, English Proficiency (Written), Instagram Marketing, Social Media Marketing",Certificate
2025-09-27 21:12:32,Business Development (Sales),Webelio Digital Pvt. Ltd,Gurgaon,Immediately,"₹ 10,000 - 15,000 /month",6 Months,22 Oct' 25,Nothing,Not Specified,"Effective Communication, English Proficiency (Spoken)","Certificate, Flexible, Letter Of Recommendation"
2025-09-27 21:12:34,Digital Marketing,Infokey Technology Private Limited,Delhi,Immediately,"₹ 5,000 - 8,000 /month",6 Months,22 Oct' 25,Nothing,Not Specified,"Digital Marketing, Email Marketing, English Proficiency (Written), Facebook Ads, Instagram Marketing, LinkedIn Marketing, Search Engine Optimization (SEO), Social Media Marketing","Certificate, Letter Of Recommendation"
2025-09-27 21:12:38,Nothing,Nothing,Not Available,Not Available,Not Available,Not Available,Not Available,Nothing,Not Specified,Not Available,Not Available
2025-09-27 21:12:38,Data Entry,Community Samvad Private Limited,Noida,Immediately,"₹ 10,000 - 12,000 /month",1 Month,22 Oct' 25,Nothing,Not Specified,"MS-Excel, MS-Office, MS-Word","Certificate, Flexible"
2025-09-27 21:12:39,Content and Social Media Marketing,Dr Prasun Chatterjee,Gurgaon,Immediately,"₹ 10,000 - 15,000 /month",6 Months,22 Oct' 25,Nothing,1. Candidates pursuing an MBA in social media management.,"CMS (Content Management System), Content Editing, Social Media Marketing",Letter Of Recommendation
2025-09-27 21:12:41,Daan Utsav Volunteer,Womenite,Delhi,Immediately,Unpaid,1 Month,22 Oct' 25,Nothing,Not Specified,Effective Communication,"Certificate, Flexible, Letter Of Recommendation, 5 Days A Week"
2025-09-27 21:12:43,Video Editing/Making,Reel on Social,Noida,Immediately,"₹ 5,000 - 20,000 /month",6 Months,22 Oct' 25,Nothing,"1. Bachelor’s degree/diploma in Film, Media, Communication, or related field (optional but preferred).","Adobe Illustrator, Adobe Photoshop, Adobe Premiere Pro, Video Editing, Video Making","Certificate, Flexible"
2025-09-27 21:12:46,Sales Executive – Offline Field Work,Aadi Foundation,Delhi,Immediately,"₹ 15,000 - 40,000 /month",6 Months,22 Oct' 25,Nothing,Not Specified,"Field Sales, Sales, Sales Strategy, Sales Support","Certificate, Letter Of Recommendation, 5 Days A Week"
2025-09-27 21:12:48,Search Engine Optimization (SEO),AIREX Electricals,Delhi,2. can start the internship between 1st Nov'25 and 15th Nov'25,"₹ 5,000 - 10,000 /month",3 Months,1 Nov - 15 Nov' 25,Nothing,Not Specified,"Digital Marketing, English Proficiency (Written), Google AdWords, Google Analytics, Search Engine Marketing (SEM), Search Engine Optimization (SEO), Social Media Marketing","Certificate, Letter Of Recommendation"
2025-09-27 21:12:50,Human Resources (HR),Cocentrus,Delhi,Immediately,"₹ 5,000 - 5,001 /month",3 Months,22 Oct' 25,Nothing,Not Specified,"English Proficiency (Spoken), English Proficiency (Written), Human Resources, MS-Excel, MS-Office, MS-Word, Recruitment, Resume screening",Certificate
2025-09-27 21:12:52,Complaint Coordinator,Thinkcloudly Private Limited,Delhi,Immediately,"₹ 10,000 - 15,000 /month",3 Months,22 Oct' 25,Nothing,Not Specified,"Effective Communication, English Proficiency (Spoken), English Proficiency (Written), MS-Excel, Problem Solving",Certificate
2025-09-27 21:12:55,MLA Office,Masters India IT Solutions Private Limited,Delhi,Immediately,"₹ 5,000 - 10,000 /month",3 Months,22 Oct' 25,Nothing,"1. Students pursuing graduation or post-graduation in any discipline (social sciences, political science, public administration preferred but not mandatory).","Effective Communication, Field Work, Interpersonal skills, Public Relations, Research and Analytics","Certificate, Letter Of Recommendation"
2025-09-27 21:12:57,Photography,DotWebServices,Delhi,Immediately,"₹ 6,000 - 8,000 /month",2 Months,22 Oct' 25,Nothing,Not Specified,Photography,"Certificate, Flexible, Letter Of Recommendation"
2025-09-27 21:13:00,Human Resources (HR),Career Consultants,Delhi,Immediately,"₹ 10,000 - 18,000 /month",2 Months,22 Oct' 25,Nothing,Not Specified,"English Proficiency (Spoken), Human Resources, Recruitment","Certificate, Letter Of Recommendation"
2025-09-27 21:13:04,Architecture,DesignBuild.Villas,Delhi,Immediately,"₹ 5,000 - 8,000 /month",3 Months,22 Oct' 25,Nothing,Not Specified,"AutoCAD, Effective Communication","Certificate, Flexible, Letter Of Recommendation"
2025-09-27 21:13:08,Video Editing/Making,Fynocrat Technologies Private Limited,Noida,Immediately,"₹ 8,000 - 20,000 /month",3 Months,22 Oct' 25,Nothing,Not Specified,"Creative Direction, Creative Thinking, Influencer Marketing, Video Making, Video Marketing","Certificate, Flexible, Letter Of Recommendation"
2025-09-27 21:13:10,Content and Social Media Marketing,Intoglo,Delhi,Immediately,"₹ 11,000 - 12,500 /month",3 Months,22 Oct' 25,Nothing,Not Specified,"Attention to Detail, Canva, Content Writing, Generative AI Tools, Market research","Certificate, Letter Of Recommendation"
2025-09-27 21:13:13,Field Sales,Shilaras,Delhi,Immediately,"₹ 10,000 - 15,000 /month",2 Months,22 Oct' 25,Nothing,Not Specified,"Effective Communication, English Proficiency (Spoken), Hindi Proficiency (Spoken), Marketing Campaigns, Market research, Sales Strategy",Letter Of Recommendation
2025-09-27 21:13:19,Fashion Design,Soumya Srivastava,Delhi,Immediately,"₹ 7,000 - 12,000 /month",3 Months,22 Oct' 25,Nothing,Not Specified,"Adobe Illustrator, Effective Communication, Fashion Designing, Technical Support","Certificate, Flexible, Letter Of Recommendation"
2025-09-27 21:13:28,3D Animation,IFOA,Gurgaon,Immediately,"₹ 5,000 - 15,000 /month",3 Months,22 Oct' 25,Nothing,Not Specified,"Autodesk Maya, Blender 3D","Certificate, Letter Of Recommendation, 5 Days A Week"
2025-09-27 21:13:30,Fashion Design,Limerick By Abirr N' Nanki,Gurgaon,Immediately,"₹ 10,000 - 15,000 /month",6 Months,22 Oct' 25,Nothing,Not Specified,"Fashion Designing, Merchandising","Certificate, Letter Of Recommendation"
2025-09-27 21:13:32,Content Creator – Salon & Makeup Industry,Nimmi Sharma,Faridabad,Immediately,"₹ 10,000 - 15,000 /month",3 Months,22 Oct' 25,Nothing,Not Specified,"Photography, Videography",Flexible
2025-09-27 21:13:35,Accounting & Tally,Asntax Private Limited,Delhi,Immediately,"₹ 7,500 - 15,000 /month",6 Months,22 Oct' 25,Nothing,Not Specified,"Accounting, Accounting Software, Busy Software, Financial Reporting, Tally","Certificate, Letter Of Recommendation"
2025-09-27 21:13:38,Frontend Developer,Primetrade.ai,Chennai,Immediately,"₹ 20,000 /month",6 Months,22 Oct' 25,Nothing,Not Specified,"Backend development, Frontend development, Python",Certificate
2025-09-27 21:13:42,Human Resources (HR),Xebia IT Architects,Gurgaon,Immediately,"₹ 10,000 /month",6 Months,22 Oct' 25,Nothing,Not Specified,Recruitment,"Flexible, 5 Days A Week"
