Date Time,profile,company,Location,Start Date,Stipend,Duration,Apply by Date,Offer,Education,Skills,Perks
2025-09-27 23:20:48,UI/UX Design,Tisteps Private Limited,Chennai,Immediately,"₹ 20,000 - 25,000 /month",6 Months,2 Oct' 25,Nothing,Not Specified,"Adobe After Effects, Adobe Photoshop, Figma, UI & UX Design, User Interface (UI) Development, Wireframing","Certificate, Flexible, 5 Days A Week"
2025-09-27 23:20:49,Product Management,Tisteps Private Limited,Chennai,Immediately,"₹ 20,000 - 25,000 /month",6 Months,2 Oct' 25,Nothing,Not Specified,"English Proficiency (Spoken), Product Lifecycle Management(PLM), Product Management","Certificate, Flexible, 5 Days A Week"
2025-09-27 23:20:51,Human Resources (HR),Tisteps Private Limited,Chennai,Immediately,"₹ 5,000 - 10,000 /month",3 Months,2 Oct' 25,Nothing,Not Specified,"Cold Calling, Effective Communication, English Proficiency (Spoken)","Certificate, Flexible, Letter Of Recommendation, 5 Days A Week"
2025-09-27 23:20:53,Market Research Analyst,Tisteps Private Limited,Chennai,Immediately,"₹ 5,000 - 15,000 /month",3 Months,Not Available,Nothing,Not Specified,"Effective Communication, Interpersonal skills, MS-Excel, Research and Analytics","Certificate, Flexible, 5 Days A Week"
2025-09-27 23:20:55,Customer Success Associate,Tisteps Private Limited,Chennai,Immediately,"₹ 5,000 - 10,000 /month",3 Months,Not Available,Nothing,Not Specified,"Customer Support, Effective Communication, MS-Excel","Certificate, Flexible, Letter Of Recommendation, 5 Days A Week"
2025-09-27 23:20:57,Nothing,Nothing,Not Available,Not Available,Not Available,Not Available,Not Available,Nothing,Not Specified,Not Available,Not Available
2025-09-27 23:20:57,Operations Associate,Tisteps Private Limited,Chennai,Immediately,"₹ 5,000 - 10,000 /month",3 Months,Not Available,Nothing,Not Specified,"Effective Communication, Leadership, Presentation skills, Strategy","Certificate, Flexible, Letter Of Recommendation, Mentorship, 5 Days A Week"
2025-09-27 23:20:58,Partnership Associate,Tisteps Private Limited,Chennai,Immediately,"₹ 5,000 - 10,000 /month",3 Months,Not Available,Nothing,Not Specified,"Effective Communication, Interpersonal skills, Presentation skills","Certificate, Flexible, 5 Days A Week"
2025-09-27 23:21:00,Nesternship – Nestlé Internship Program 2024,Nestle,Chennai,Not Available,"₹ 10,000 /month",2 Months,25 Dec' 25,Nothing,Not Specified,"Business Analysis, Effective Communication, Logistics Management, Problem Solving, Strategy",Certificate
2025-09-27 23:21:01,Assistant Manager VCIP – Fixed Term Contract (6 Months),HSBC Bank,Chennai,Not Available,Not Available,Assistant Manager VCIP – Fixed Term Contract (6 Months),4 Dec' 25,Nothing,Not Specified,"Customer Support, Effective Communication, KYC, Operations, Risk Management, Statutory compliances",Flexible
2025-09-27 23:21:03,Interim Engineering Intern (Software),Qualcomm,Chennai,Not Available,Not Available,3 weeks ago,21 Nov' 25,Nothing,Not Specified,"Algorithms, C++ Programming, C Programming, Data Structures, Linux, Problem Solving",Not Available
2025-09-27 23:21:04,Business Analytics,McKinsey & Company,Chennai,Not Available,Not Available,2 Months,28 Oct' 25,Nothing,1. Educational background: Relevant undergraduate degree in progress.,"Data Analysis, Decision making, Effective Communication, English Proficiency (Spoken), English Proficiency (Written), MS-Excel, MS-PowerPoint, Time Management",Mentorship
2025-09-27 23:21:06,Associate - Client Service,McKinsey & Company,Chennai,Not Available,Not Available,2 Months,27 Oct' 25,Nothing,"1. Educational background: Enrolled in an advanced graduate degree program (e.g., MBA, PhD); requirements may vary by location or practice.","Data Analysis, Decision making, Effective Communication, English Proficiency (Spoken), English Proficiency (Written), MS-Excel, MS-PowerPoint, Time Management",Mentorship
