Date Time,profile,company,Location,Start Date,Stipend,Duration,Apply by Date,Offer,Education,Skills,Perks
2025-09-27 23:12:57,Operations & Marketing,Blue Damp Lifestyle,Chennai,Immediately,"₹ 8,000 - 10,000 /month",3 Months,24 Oct' 25,Nothing,Not Specified,"Creativity, Instagram Marketing, MS-Excel, Problem Solving, Social Media Marketing",Certificate
2025-09-27 23:12:59,Business Research,Nesa Medtech Private Limited,Chennai,Immediately,"₹ 10,000 /month",2 Months,26 Oct' 25,Nothing,1. Bachelor of Business Administration (BBA) – freshers encouraged to apply.,"English Proficiency (Spoken), Interpersonal skills, MS-Office, Networking","Certificate, 5 Days A Week"
2025-09-27 23:13:01,Business Development (Sales),Thryve Z,Chennai,Immediately,"₹ 17,000 - 35,000 /month",2 Months,25 Oct' 25,Nothing,"4. Recruit, train, and manage campus ambassadors across colleges.","English Proficiency (Spoken), Leadership, Marketing, Sales, Sales Strategy","Certificate, Flexible, Letter Of Recommendation"
2025-09-27 23:13:04,Architecture,Urban Nest,Chennai,Immediately,"₹ 17,000 - 25,000 /month",6 Months,25 Oct' 25,Nothing,Not Specified,"Adobe Photoshop, AutoCAD, Autodesk 3ds Max, Autodesk Revit, Google SketchUp, MS-Office","Certificate, Flexible, Letter Of Recommendation"
2025-09-27 23:13:05,Media & Public Relations (PR),Go Picnic Technology Solutions,Chennai,Immediately,"₹ 5,000 - 6,001 /month",1 Month,23 Oct' 25,Nothing,"4. are from Chennai, Tiruvallur, Kanchipuram, Avadi, Tambaram Sanatorium only","Creative Writing, English Proficiency (Spoken), Social Media Marketing","Certificate, Letter Of Recommendation"
2025-09-27 23:13:07,Business Development (Sales),Mithra Consulting,Chennai,Immediately,"₹ 15,000 - 20,000 /month",6 Months,26 Oct' 25,Nothing,Not Specified,"English Proficiency (Spoken), English Proficiency (Written), MS-Excel, Sales, Sales Strategy","Certificate, Letter Of Recommendation"
2025-09-27 23:13:08,Growth (Digital+Operations),Osera Living,Chennai,Immediately,"₹ 8,000 - 12,000 /month",3 Months,24 Oct' 25,Nothing,Not Specified,"Content Writing, English Proficiency (Spoken), English Proficiency (Written), MS-Excel, Social Media Marketing","Certificate, Flexible, Letter Of Recommendation, 5 Days A Week"
2025-09-27 23:13:10,Human Resources (HR),Windzard Technologies Private Limited,Chennai,Immediately,"₹ 13,000 - 20,000 /month",4 Months,26 Oct' 25,Nothing,Not Specified,"English Proficiency (Spoken), English Proficiency (Written), MS-Office","Certificate, Flexible, Letter Of Recommendation"
2025-09-27 23:13:11,Business Development (Sales),Zopper,Chennai,Immediately,"₹ 12,000 - 22,000 /month",6 Months,26 Oct' 25,Nothing,1. Any kind of degree will work as long as the person is street smart,"Client Relationship, Sales Management, Sales Strategy","Certificate, Flexible, Letter Of Recommendation, 5 Days A Week"
2025-09-27 23:13:13,MBA/BBA Climate Business Internship,Energy Alternatives India,Chennai,Immediately,"₹ 15,000 - 20,000 /month",2 Months,27 Oct' 25,Nothing,Not Specified,"Business Development, Business Management, Business Research, Marketing, Strategy","Certificate, Letter Of Recommendation"
2025-09-27 23:13:15,Nothing,Nothing,Not Available,Not Available,Not Available,Not Available,Not Available,Nothing,Not Specified,Not Available,Not Available
2025-09-27 23:13:15,Sales Trainee,Avaesa,Chennai,Immediately,"₹ 5,000 - 10,000 /month",4 Months,23 Oct' 25,Nothing,Not Specified,"Effective Communication, English Proficiency (Spoken), English Proficiency (Written)",Certificate
2025-09-27 23:13:16,Embedded Systems,Meteoros Automation,Chennai,Immediately,"₹ 4,000 - 4,200 /month",6 Months,25 Oct' 25,Nothing,Not Specified,"ARM Microcontroller, Circuit Design, C Programming, EAGLE, Effective Communication, Embedded Systems, Internet of Things (IoT), Network protocols","Certificate, Flexible, Letter Of Recommendation, 5 Days A Week"
2025-09-27 23:13:18,Architecture,Tisteps Private Limited,Chennai,Immediately,"₹ 30,000 - 40,000 /month",6 Months,5 Nov' 25,Nothing,Not Specified,"Adobe Photoshop, AutoCAD, Autodesk Revit, MS-Office","Certificate, Flexible, Letter Of Recommendation, 5 Days A Week"
2025-09-27 23:13:19,Digital Marketing,ALMI Blogging School Pro (Almi Production Land Solar Private Limited),Chennai,Immediately,"₹ 3,000 - 5,000 /month",2 Months,22 Oct' 25,Nothing,Not Specified,"Email Marketing, Facebook Marketing, Instagram Marketing, Search Engine Marketing (SEM), Search Engine Optimization (SEO), Social Media Marketing",Not Available
2025-09-27 23:13:21,Business Development (Sales),Rx Solutions,Chennai,Immediately,"₹ 12,000 - 14,500 /month",3 Months,16 Oct' 25,Nothing,"1. Pursuing or completed Bachelor’s degree in Business, Marketing, or related field.","B2B Sales, Digital Marketing, Sales, Social Media Marketing",Certificate
2025-09-27 23:13:23,Digital Marketing,XODUSE MEDIA,Chennai,Immediately,"₹ 2,000 - 5,000 /month",3 Months,22 Oct' 25,Nothing,Not Specified,"Content Editing, Content Writing, Creative Thinking, Instagram Marketing, Social Media Marketing","Certificate, Letter Of Recommendation"
2025-09-27 23:13:24,Videography,Ashtrix Robotics And Research Centre,Chennai,Immediately,"₹ 2,000 - 2,500 /month",3 Months,11 Oct' 25,Nothing,Not Specified,"Adobe After Effects, Adobe Photoshop, Adobe Premiere Pro, Photography, Video Editing, Video Making","Certificate, Flexible, Letter Of Recommendation"
2025-09-27 23:13:26,Field Sales,Global Edutech,Chennai,Immediately,"₹ 7,500 - 15,000 /month",3 Months,10 Oct' 25,Nothing,"1. Pursuing/completed a Bachelor's degree in Business, Marketing, or any related field.","Client Relationship Management (CRM), Customer Acquisition, Effective Communication, English Proficiency (Spoken), Hindi Proficiency (Spoken), Marketing, Sales","Certificate, Flexible, Letter Of Recommendation, Mentorship"
2025-09-27 23:13:27,Campus Ambassador,JK Shah Classes,Ahmedabad,Immediately,Not Available,2 Months,23 Oct' 25,Nothing,"1. ACCA Awareness & Outreach: Identify and connect with commerce and undergraduate students (B.Com, BAF, BMS, etc.) across your campus and network who may be interested in global accounting careers, introducing them to the ACCA course offered by JK Shah Classes.","Client Relationship, Effective Communication, English Proficiency (Spoken), Marketing, Negotiation, Problem Solving","Certificate, Flexible, Letter Of Recommendation"
2025-09-27 23:13:29,Talent Acquisition,TIRWIN Management Services Private Limited,Tambaram Sanatorium,Immediately,"₹ 8,000 - 10,000 /month",6 Months,9 Oct' 25,Nothing,4. are from Tambaram Sanatorium only,"English Proficiency (Spoken), English Proficiency (Written), Recruitment","Certificate, Letter Of Recommendation"
2025-09-27 23:13:30,Finance,XODUSE MEDIA,Chennai,Immediately,"₹ 2,000 - 5,000 /month",3 Months,22 Oct' 25,Nothing,Not Specified,"Financial Analysis, MS-Office","Certificate, Letter Of Recommendation"
2025-09-27 23:13:32,Mechanical/Electrical Interns (For Supply Chain Management),Perfint Healthcare Private Limited,Chennai,Immediately,"₹ 10,000 - 15,000 /month",6 Months,22 Oct' 25,Nothing,Not Specified,"Analytical Thinking, Assembly, Power Systems, Problem Solving, Soldering","Certificate, Flexible, Letter Of Recommendation"
2025-09-27 23:13:34,Event Management,EduAce Services,Chennai,Immediately,"₹ 5,000 - 10,000 /month",3 Months,22 Oct' 25,Nothing,Not Specified,"English Proficiency (Spoken), English Proficiency (Written), Event Management, MS-Excel","Certificate, Flexible, Letter Of Recommendation"
2025-09-27 23:13:35,Admin & Operations Executive,Atrium Coworks,Chennai,Immediately,"₹ 5,000 - 15,000 /month",1 Month,8 Oct' 25,Nothing,Not Specified,"Collaboration, Coordination, Effective Communication, Leadership, MS-Office, Team Management","Certificate, Flexible, Letter Of Recommendation, Mentorship"
2025-09-27 23:13:36,Content and Social Media Marketing,Origin Nutrition,Chennai,Immediately,"₹ 10,000 - 12,000 /month",3 Months,18 Oct' 25,Nothing,1. Open to final year students and recent graduates,"Content Writing, English Proficiency (Spoken), English Proficiency (Written)","Certificate, 5 Days A Week"
2025-09-27 23:13:38,Business Development (Sales),ALMI Blogging School Pro (Almi Production Land Solar Private Limited),Chennai,Immediately,"₹ 2,000 - 3,000 /month",3 Months,4 Oct' 25,Nothing,Not Specified,"Content Writing, Digital Marketing, Email Marketing, Search Engine Optimization (SEO)","Certificate, Letter Of Recommendation"
2025-09-27 23:13:40,Climate Tech Marketing,Energy Alternatives India,Chennai,Immediately,"₹ 15,000 - 20,000 /month",2 Months,18 Oct' 25,Nothing,"2. MBA a plus, but not compulsory","Creative Thinking, Effective Communication, Marketing, Marketing Strategies, Problem Solving, Sales","Certificate, Flexible, Letter Of Recommendation"
2025-09-27 23:13:42,Market Research - Sustainability & Climate Tech,Energy Alternatives India,Chennai,Immediately,"₹ 15,000 - 20,000 /month",2 Months,18 Oct' 25,Nothing,Not Specified,"Blogging, Business Analysis, Business Research, Content Writing, Effective Communication, Report Writing, Research and Analytics","Certificate, Flexible, Letter Of Recommendation"
2025-09-27 23:13:43,Digital Marketing,Hinisys Software,Chennai,Immediately,"₹ 6,000 - 8,000 /month",3 Months,Not Available,Nothing,Not Specified,"Creative Writing, Email Marketing, English Proficiency (Written)","Certificate, Flexible, Letter Of Recommendation, 5 Days A Week"
2025-09-27 23:13:45,Accounting & Tally,Notion Press Media Private Limited,Chennai,Immediately,"₹ 10,000 - 12,000 /month",6 Months,6 Oct' 25,Nothing,Not Specified,Accounting,"Certificate, Letter Of Recommendation, 5 Days A Week"
2025-09-27 23:13:47,Strategy Consulting - Sustainability & Climate Tech,Energy Alternatives India,Chennai,Immediately,"₹ 15,000 - 20,000 /month",2 Months,18 Oct' 25,Nothing,Not Specified,"Business Analysis, Business Research, Client Relationship, Effective Communication, Market Analysis, Problem Solving","Certificate, Flexible, Letter Of Recommendation"
2025-09-27 23:13:49,Video Editing/Making,Avaesa,Chennai,Immediately,"₹ 10,000 - 12,000 /month",4 Months,6 Oct' 25,Nothing,Not Specified,"Adobe Illustrator, Adobe Photoshop, Adobe Premiere Pro, Final Cut Pro, Video Editing, Video Making",Certificate
2025-09-27 23:13:50,Program Management for Climate Tech,Energy Alternatives India,Chennai,Immediately,"₹ 15,000 - 20,000 /month",2 Months,18 Oct' 25,Nothing,Not Specified,"Business Analysis, Client Interaction, Effective Communication, Interpersonal skills, Marketing, Problem Solving, Project Management, Strategy","Certificate, Letter Of Recommendation"
2025-09-27 23:13:52,Digital Marketing,Aakash Fertility Centre & Hospital,Chennai,Immediately,"₹ 3,000 - 5,000 /month",3 Months,10 Oct' 25,Nothing,Not Specified,Search Engine Optimization (SEO),Certificate
2025-09-27 23:13:53,Operations,NeoMotion Assistive Solutions Private Limited,Chennai,Immediately,"₹ 8,000 - 12,000 /month",6 Months,8 Oct' 25,Nothing,"1. Currently pursuing or recently completed a degree in business administration, operations management, or a related field.","Client Relationship Management (CRM), Kannada Proficiency (Spoken), MS-Excel, Operations, Planning, Telugu Proficiency (Spoken)","Certificate, Letter Of Recommendation"
2025-09-27 23:13:55,Biotech Research For Climate Studies,Energy Alternatives India,Chennai,Immediately,"₹ 15,000 - 20,000 /month",2 Months,18 Oct' 25,Nothing,Not Specified,"Bioinformatics, Biology, Business Research, Chemistry, Next Generation Sequencing (NGS), Report Writing, System Biology","Certificate, Letter Of Recommendation"
2025-09-27 23:13:57,Partnerships & Outreach,Caarya,Bhubaneswar,Immediately,"₹ 8,000 - 15,000 /month",2 Months,22 Oct' 25,Nothing,"1. Research and identify potential NGO, startup, and student venture partners.","Client Relationship Management (CRM), Cold Calling, Effective Communication, Email Marketing, English Proficiency (Spoken), Google Sheets, Hindi Proficiency (Spoken), Interpersonal skills","Certificate, Flexible, Letter Of Recommendation, Mentorship"
2025-09-27 23:13:58,Social Media Marketing,Mindenious Edutech,Chennai,Immediately,"₹ 6,000 - 15,000 /month",2 Months,27 Oct' 25,Nothing,Not Specified,"Digital Marketing, Email Marketing, English Proficiency (Spoken), Facebook Marketing, Instagram Marketing, Social Media Marketing","Certificate, Letter Of Recommendation, Mentorship"
2025-09-27 23:14:00,Social Media Marketing,Anarock Property Consultants Private Limited,Chennai,Immediately,"₹ 2,000 /month",3 Months,26 Oct' 25,Nothing,Not Specified,"Content Editing, Creative Writing, Digital Marketing, Email Marketing, English Proficiency (Spoken), Facebook Marketing, Instagram Marketing, Search Engine Marketing (SEM)","Certificate, Flexible"
2025-09-27 23:14:01,Recruitment,Experienzing Consulting Solutions,Chennai,Immediately,"₹ 6,500 - 10,500 /month",2 Months,26 Oct' 25,Nothing,Not Specified,"English Proficiency (Spoken), LinkedIn Marketing, MS-Office","Certificate, Letter Of Recommendation, 5 Days A Week"
2025-09-27 23:14:03,Product Marketing,Mindenious Edutech,Chennai,Immediately,"₹ 3,000 - 10,000 /month",4 Months,26 Oct' 25,Nothing,Not Specified,"Effective Communication, Marketing, Marketing Campaigns, Marketing Strategies, Market research, MS-Excel","Certificate, Letter Of Recommendation, Mentorship"
2025-09-27 23:14:05,Business Development (Sales),Sigillieum Software Consultants Pvt.Ltd,Chennai,Immediately,"₹ 8,000 - 15,000 /month",6 Months,26 Oct' 25,Nothing,Not Specified,"Client Relationship Management (CRM), Effective Communication, English Proficiency (Spoken), Interpersonal skills, MS-Excel, Negotiation, Tamil Proficiency (Spoken)","Certificate, Flexible, Letter Of Recommendation"
2025-09-27 23:14:07,Brand Management,The Gurus,Chennai,Immediately,"₹ 6,000 - 10,000 /month",2 Months,26 Oct' 25,Nothing,Not Specified,"Digital Marketing, English Proficiency (Spoken), English Proficiency (Written), Social Media Marketing","Certificate, Letter Of Recommendation"
2025-09-27 23:14:08,Project Management,Notion Press Media Private Limited,Chennai,Immediately,"₹ 5,000 - 10,000 /month",2 Months,26 Oct' 25,Nothing,"1. Recent graduates or final-year students (any discipline, preferably Management, Communications, or related fields).","Effective Communication, MS-Office","Certificate, Flexible, Letter Of Recommendation"
2025-09-27 23:14:10,Product Design,D2B Technologies Private Limited (Boxs),Chennai,Immediately,"₹ 8,000 - 10,000 /month",3 Months,25 Oct' 25,Nothing,Not Specified,Google SketchUp,"Flexible, 5 Days A Week"
2025-09-27 23:14:12,Human Resources (HR),Justdial Limited,Chennai,Immediately,"₹ 8,000 - 10,000 /month",3 Months,25 Oct' 25,Nothing,"1. Candidates pursuing or have completed BBA,B.COM, M.COM,MBA","English Proficiency (Spoken), English Proficiency (Written), Mathematics, MS-Office, Payroll","Certificate, Letter Of Recommendation"
2025-09-27 23:14:14,Human Resources (HR),Unique Org,Chennai,Immediately,"₹ 3,000 - 6,000 /month",3 Months,25 Oct' 25,Nothing,Not Specified,"Effective Communication, English Proficiency (Spoken), English Proficiency (Written), MS-Excel, MS-Office, MS-Word","Certificate, Letter Of Recommendation"
2025-09-27 23:14:15,Business Development (Sales),DTYLE AI NUVIEW PVT LTD,Chennai,Immediately,"₹ 5,000 - 10,000 /month",6 Months,25 Oct' 25,Nothing,Not Specified,"Client Relationship Management (CRM), Effective Communication, Email Marketing, English Proficiency (Spoken), Hindi Proficiency (Spoken), MS-Excel","Certificate, 5 Days A Week"
2025-09-27 23:14:18,Marketing,Gigart Solutions Private Limited,Chennai,Immediately,"₹ 6,000 - 10,000 /month",4 Months,24 Oct' 25,Nothing,"1. Bachelor's degree in accounting, finance, law, business administration, or related fields","Digital Marketing, Email Marketing, English Proficiency (Spoken), English Proficiency (Written), Finance, Sales Strategy, Social Media Marketing","Certificate, Letter Of Recommendation"
2025-09-27 23:14:20,Graphic Design,Murugesh Chandran,Chennai,Immediately,"₹ 10,000 /month",6 Months,24 Oct' 25,Nothing,Not Specified,"Adobe After Effects, Adobe Illustrator, Adobe Photoshop, Canva, Video Editing",Not Available
2025-09-27 23:14:23,Business Development (Sales),Sigillieum Software Consultants Pvt.Ltd,Chennai,Immediately,"₹ 8,000 - 15,000 /month",6 Months,26 Oct' 25,Nothing,Not Specified,"Client Relationship Management (CRM), Effective Communication, English Proficiency (Spoken), Interpersonal skills, MS-Excel, Negotiation, Tamil Proficiency (Spoken)","Certificate, Flexible, Letter Of Recommendation"
2025-09-27 23:14:25,Brand Management,The Gurus,Chennai,Immediately,"₹ 6,000 - 10,000 /month",2 Months,26 Oct' 25,Nothing,Not Specified,"Digital Marketing, English Proficiency (Spoken), English Proficiency (Written), Social Media Marketing","Certificate, Letter Of Recommendation"
2025-09-27 23:14:27,Project Management,Notion Press Media Private Limited,Chennai,Immediately,"₹ 5,000 - 10,000 /month",2 Months,26 Oct' 25,Nothing,"1. Recent graduates or final-year students (any discipline, preferably Management, Communications, or related fields).","Effective Communication, MS-Office","Certificate, Flexible, Letter Of Recommendation"
2025-09-27 23:14:29,Product Design,D2B Technologies Private Limited (Boxs),Chennai,Immediately,"₹ 8,000 - 10,000 /month",3 Months,25 Oct' 25,Nothing,Not Specified,Google SketchUp,"Flexible, 5 Days A Week"
2025-09-27 23:14:30,Human Resources (HR),Justdial Limited,Chennai,Immediately,"₹ 8,000 - 10,000 /month",3 Months,25 Oct' 25,Nothing,"1. Candidates pursuing or have completed BBA,B.COM, M.COM,MBA","English Proficiency (Spoken), English Proficiency (Written), Mathematics, MS-Office, Payroll","Certificate, Letter Of Recommendation"
2025-09-27 23:14:32,Human Resources (HR),Unique Org,Chennai,Immediately,"₹ 3,000 - 6,000 /month",3 Months,25 Oct' 25,Nothing,Not Specified,"Effective Communication, English Proficiency (Spoken), English Proficiency (Written), MS-Excel, MS-Office, MS-Word","Certificate, Letter Of Recommendation"
2025-09-27 23:14:33,Business Development (Sales),DTYLE AI NUVIEW PVT LTD,Chennai,Immediately,"₹ 5,000 - 10,000 /month",6 Months,25 Oct' 25,Nothing,Not Specified,"Client Relationship Management (CRM), Effective Communication, Email Marketing, English Proficiency (Spoken), Hindi Proficiency (Spoken), MS-Excel","Certificate, 5 Days A Week"
2025-09-27 23:14:35,Marketing,Gigart Solutions Private Limited,Chennai,Immediately,"₹ 6,000 - 10,000 /month",4 Months,24 Oct' 25,Nothing,"1. Bachelor's degree in accounting, finance, law, business administration, or related fields","Digital Marketing, Email Marketing, English Proficiency (Spoken), English Proficiency (Written), Finance, Sales Strategy, Social Media Marketing","Certificate, Letter Of Recommendation"
2025-09-27 23:14:37,Graphic Design,Murugesh Chandran,Chennai,Immediately,"₹ 10,000 /month",6 Months,24 Oct' 25,Nothing,Not Specified,"Adobe After Effects, Adobe Illustrator, Adobe Photoshop, Canva, Video Editing",Not Available
2025-09-27 23:14:38,Accounting & Bookkeeping,Regami Solutions,Chennai,Immediately,"₹ 5,000 - 8,000 /month",6 Months,24 Oct' 25,Nothing,"1. Pursuing/completed degree in commerce, finance, or accounting (B.Com/M.Com/CA Inter or related field)","Accounting, GST, Journal Entries, MS-Office",Certificate
2025-09-27 23:14:40,Nothing,Nothing,Not Available,Not Available,Not Available,Not Available,Not Available,Nothing,Not Specified,Not Available,Not Available
2025-09-27 23:14:40,Human Resources (HR),Protium,Chennai,Immediately,"₹ 20,000 - 30,000 /month",6 Months,24 Oct' 25,Nothing,Not Specified,MS-Office,"Certificate, Letter Of Recommendation"
2025-09-27 23:14:42,Social Media Marketing,Kreshya Private Limited,Chennai,Immediately,"₹ 14,000 - 19,000 /month",3 Months,24 Oct' 25,Nothing,Not Specified,"Creative Writing, Digital Marketing, English Proficiency (Spoken), English Proficiency (Written), Instagram Marketing, Search Engine Optimization (SEO), Social Media Marketing","Certificate, Flexible, Letter Of Recommendation, 5 Days A Week"
2025-09-27 23:14:44,FinTech & Data Analytics,Nebulytix Technologies,Chennai,Immediately,"₹ 10,000 - 15,000 /month",3 Months,24 Oct' 25,Nothing,Not Specified,".NET, Artificial intelligence, Digital Advertising, Java, Python, Web development","Certificate, Flexible, Letter Of Recommendation, 5 Days A Week"
2025-09-27 23:14:46,Human Resources (HR),RAMSOL Private Limited,Chennai,Immediately,"₹ 6,000 - 13,000 /month",3 Months,23 Oct' 25,Nothing,Not Specified,"Effective Communication, English Proficiency (Spoken), Recruitment",Certificate
2025-09-27 23:14:48,Event Producer,Social Age,Chennai,Immediately,"₹ 2,000 - 35,000 /month",6 Months,23 Oct' 25,Nothing,"1. Education: Currently pursuing or recently completed Bachelor’s/Master’s (Hospitality, Event Management, Marketing, Media, or related fields).","Event Management, Interpersonal skills, Marketing","Certificate, Flexible, Letter Of Recommendation, Mentorship"
2025-09-27 23:14:50,Civil Engineering,Urbanroof,Chennai,Immediately,"₹ 16,000 - 22,000 /month",3 Months,23 Oct' 25,Nothing,Not Specified,"Effective Communication, Tamil Proficiency (Spoken), Tamil Proficiency (Written)","Certificate, Letter Of Recommendation"
2025-09-27 23:14:51,Digital Marketing,CoinFantasy,Chennai,Immediately,"₹ 10,000 /month",3 Months,23 Oct' 25,Nothing,1. Candidates who have completed a BBA or are pursuing a final year MBA and are interested in working in a digital marketing team.,"Creative Writing, Digital Marketing, Email Marketing, English Proficiency (Spoken), English Proficiency (Written), Instagram Marketing, Search Engine Marketing (SEM), Search Engine Optimization (SEO)",Certificate
2025-09-27 23:14:54,Research & Insights,Caarya,Chennai,Immediately,"₹ 7,000 - 15,000 /month",2 Months,22 Oct' 25,Nothing,Not Specified,"Attention to Detail, Email Management, Google Sheets, Lead Generation, MS-Excel, Research and Analytics, Sales Strategy","Certificate, Flexible, Letter Of Recommendation"
2025-09-27 23:14:56,Customer Service/Customer Support,DHOBI G,Chennai,Immediately,"₹ 11,000 - 17,000 /month",3 Months,22 Oct' 25,Nothing,Not Specified,"Client Interaction, Customer Support, Effective Communication, English Proficiency (Spoken), English Proficiency (Written), Interpersonal skills, MS-Excel, MS-Office","Certificate, Letter Of Recommendation"
2025-09-27 23:14:59,sales,Smart Mobile Finance,Chennai,Immediately,"₹ 8,000 - 15,000 /month",6 Months,22 Oct' 25,Nothing,Not Specified,"Business Development, Client Relationship Management (CRM), Cold Calling, Email Marketing, Field Work, Sales","Certificate, Flexible, Letter Of Recommendation, 5 Days A Week"
2025-09-27 23:15:01,Experience Partner (Sales),Cars24 Services Private Limited,Chennai,Immediately,"₹ 10,000 - 20,000 /month",3 Months,22 Oct' 25,Nothing,2. Students or recent graduates looking to gain practical exposure in the sales industry. Comfortable working weekends (Saturday & Sunday).,"Client Interaction, Effective Communication, Presentation skills, Problem Solving, Sales","Certificate, Letter Of Recommendation"
2025-09-27 23:15:02,Experience Partners (Sales),Cars24 Services Private Limited,Chennai,Immediately,"₹ 10,000 - 20,000 /month",3 Months,22 Oct' 25,Nothing,2. Students or recent graduates looking to gain practical exposure in the sales industry. Comfortable working weekends (Saturday & Sunday).,"Client Interaction, Effective Communication, Presentation skills, Problem Solving, Sales","Certificate, Letter Of Recommendation"
2025-09-27 23:15:04,Frontend Developer,Primetrade.ai,Chennai,Immediately,"₹ 20,000 /month",6 Months,22 Oct' 25,Nothing,Not Specified,"Backend development, Frontend development, Python",Certificate
2025-09-27 23:15:06,Architecture,Integrative Design Solutions Private Limited,Chennai,Immediately,"₹ 10,000 - 15,000 /month",6 Months,22 Oct' 25,Nothing,"1. Students or recent graduates in architecture, environmental engineering, urban","Adobe Illustrator, Adobe Photoshop, AutoCAD, Autodesk 3ds Max, Autodesk Revit, Data Analysis, Google SketchUp, MS-Office",Certificate
2025-09-27 23:15:07,Founders Office,Just Studio Technology,Chennai,Immediately,"₹ 3,000 - 10,000 /month",6 Months,22 Oct' 25,Nothing,1. Currently pursuing or recently graduated (business/management/commerce/engineering preferred).,"B2B Sales, Business Development, Entrepreneurship, Marketing, Sales, Social Media Marketing","Certificate, Mentorship"
2025-09-27 23:15:09,Inside Sales,EDU SHIKSHAVERTEX PRIVATE LIMITED,Chennai,Immediately,"₹ 25,000 - 32,000 /month",3 Months,20 Oct' 25,Nothing,Not Specified,Effective Communication,"Certificate, Letter Of Recommendation, Mentorship"
2025-09-27 23:15:11,Sales and Marketing,EDU SHIKSHAVERTEX PRIVATE LIMITED,Anantapur,Immediately,"₹ 25,000 - 29,000 /month",3 Months,20 Oct' 25,Nothing,Not Specified,Effective Communication,"Certificate, Letter Of Recommendation, Mentorship"
2025-09-27 23:15:12,Backend Development,Meteoros Automation,Chennai,Immediately,"₹ 4,000 - 4,200 /month",6 Months,19 Oct' 25,Nothing,Not Specified,"Docker, Java, Linux, REST API, Spring Boot, SQL","Certificate, Flexible, Letter Of Recommendation, 5 Days A Week"
2025-09-27 23:15:14,Customer Service/Customer Support,Nura Electric Mobility Private Limited,Chennai,Immediately,"₹ 6,000 - 8,000 /month",3 Months,19 Oct' 25,Nothing,1. Any degree is welcome to apply,"English Proficiency (Spoken), MS-Excel, MS-Office, Tamil Proficiency (Spoken)","Certificate, 5 Days A Week"
2025-09-27 23:15:16,Business Development (Sales),EDU SHIKSHAVERTEX PRIVATE LIMITED,Chennai,Immediately,"₹ 27,000 - 32,000 /month",3 Months,19 Oct' 25,Nothing,Not Specified,Effective Communication,"Certificate, Letter Of Recommendation, Mentorship"
