Date Time,profile,company,Location,Start Date,Stipend,Duration,Apply by Date,Offer,Education,Skills,Perks
2025-09-27 21:49:22,Event Management,Inductus,Noida,Immediately,"₹ 2,000 /month",3 Months,6 Oct' 25,Nothing,Not Specified,"English Proficiency (Spoken), English Proficiency (Written), Event Management, MS-Excel, MS-Office, Social Media Marketing","Certificate, Letter Of Recommendation"
2025-09-27 21:49:24,Social Media Marketing,EVOLV DIGITAL MEDIA,Delhi,Immediately,"₹ 8,000 - 12,000 /month",3 Months,6 Oct' 25,Nothing,"4. are from Delhi, Indore, Mumbai, Jaipur only","English Proficiency (Written), Instagram Marketing, Social Media Marketing","Certificate, Flexible, Letter Of Recommendation"
2025-09-27 21:49:25,Social Media Marketing,Sushant Jayswal,Delhi,Immediately,"₹ 11,000 - 17,000 /month",2 Months,6 Oct' 25,Nothing,Not Specified,"Digital Marketing, Social Media Marketing","Certificate, Flexible, Letter Of Recommendation"
2025-09-27 21:49:27,Video Editing/Making,Neobound Technologies Pvt Ltd,Gurgaon,Immediately,"₹ 7,000 - 10,000 /month",6 Months,6 Oct' 25,Nothing,Not Specified,"Video Editing, Video Making","Certificate, Flexible"
2025-09-27 21:49:29,Marketing,Kosmc AI,Delhi,Immediately,"₹ 5,000 /month",3 Months,6 Oct' 25,Nothing,Not Specified,"Email Management, English Proficiency (Spoken), English Proficiency (Written), Management, MS-Excel, MS-Office, Social Media Marketing","Certificate, Flexible, Letter Of Recommendation"
2025-09-27 21:49:32,Content Writing,Adstacks Media,Gurgaon,Immediately,"₹ 10,000 - 11,000 /month",3 Months,8 Oct' 25,Nothing,Not Specified,"Blogging, Creative Writing, Digital Marketing, English Proficiency (Written), Social Media Marketing, Storyboarding","Certificate, Letter Of Recommendation, 5 Days A Week"
2025-09-27 21:49:34,Human Resources (HR),Growify Digital,Delhi,Immediately,"₹ 10,000 - 15,000 /month",6 Months,6 Oct' 25,Nothing,Not Specified,"Employment engagement, English Proficiency (Spoken), English Proficiency (Written), MS-Excel, MS-Word, Operations, Recruitment","Certificate, Letter Of Recommendation"
2025-09-27 21:49:36,SEO Executive,Adstacks Media,Gurgaon,Immediately,"₹ 10,000 - 11,000 /month",3 Months,6 Oct' 25,Nothing,"1. Bachelor's degree in Marketing, Digital Marketing, IT, or related field.",Search Engine Optimization (SEO),"Certificate, Letter Of Recommendation, 5 Days A Week"
2025-09-27 21:49:38,Front End Development,Dofin Tech Private Limited,Gurgaon,Immediately,"₹ 13,000 - 18,000 /month",6 Months,6 Oct' 25,Nothing,Not Specified,"Bootstrap, CSS, Flutter, GitHub, HTML, JavaScript, Next.js, Node.js","Certificate, Letter Of Recommendation"
2025-09-27 21:49:41,AI Agent Development,Growify Digital,Delhi,Immediately,"₹ 12,000 /month",6 Months,6 Oct' 25,Nothing,"1. Currently enrolled in or recent graduate of a Bachelor's/Master's program in Computer Science, Data Science, AI, Marketing, or a related field.","Artificial intelligence, JavaScript","Certificate, Letter Of Recommendation"
2025-09-27 21:49:43,Business Development (Sales),Growify Digital,Delhi,Immediately,"₹ 15,000 /month",6 Months,6 Oct' 25,Nothing,Not Specified,"Digital Marketing, Email Marketing, English Proficiency (Spoken), English Proficiency (Written), MS-Excel, Social Media Marketing","Certificate, Letter Of Recommendation"
2025-09-27 21:49:45,Human Resources (HR),Reliance Broadcast Network Limited,Gurgaon,Immediately,"₹ 7,000 - 7,500 /month",3 Months,6 Oct' 25,Nothing,Not Specified,Recruitment,Not Available
2025-09-27 21:49:47,Content Writing,Unimonks,Delhi,Immediately,"₹ 4,500 - 13,000 /month",3 Months,6 Oct' 25,Nothing,Not Specified,"ChatGPT, Creative Writing, English Proficiency (Written)",Certificate
2025-09-27 21:49:49,Teaching,Unimonks,Delhi,Immediately,"₹ 6,000 - 16,000 /month",4 Months,6 Oct' 25,Nothing,3. Provide one-on-one support to students who may need extra help.,"English Proficiency (Spoken), Teaching",Certificate
2025-09-27 21:49:52,Sales and Marketing,IndiaWelds,Faridabad,Immediately,"₹ 8,000 - 10,000 /month",6 Months,6 Oct' 25,Nothing,Not Specified,"Client Interaction, Customer Acquisition, English Proficiency (Spoken), English Proficiency (Written), Sales, Sales Strategy",Certificate
2025-09-27 21:49:54,Content and Social Media Marketing,Eka Studio By Sana,Delhi,Immediately,"₹ 8,000 - 12,000 /month",3 Months,27 Oct' 25,Nothing,Not Specified,"AI Image Generation, AI Video Generation, Artificial intelligence, Branding, ChatGPT, Content Editing, Content Writing, Facebook Ads","Certificate, Letter Of Recommendation"
2025-09-27 21:49:56,Interior Design,Eka Studio By Sana,Delhi,Immediately,"₹ 8,500 - 12,000 /month",3 Months,27 Oct' 25,Nothing,Not Specified,"Architectural Drafting, AutoCAD, Autodesk 3ds Max, Google SketchUp, Interior design","Certificate, Letter Of Recommendation"
2025-09-27 21:49:58,Video Editing/Making,Nirmandwar Private Limited,Delhi,Immediately,"₹ 6,000 - 16,000 /month",3 Months,5 Oct' 25,Nothing,Not Specified,"Adobe Illustrator, Adobe Photoshop, Video Editing, Video Making","Certificate, Flexible, Letter Of Recommendation"
2025-09-27 21:50:01,Business Development (Sales),Standard Digital Mind,Delhi,Immediately,"₹ 12,000 - 19,000 /month",3 Months,5 Oct' 25,Nothing,Not Specified,"Effective Communication, Lead Generation","Certificate, Flexible, Letter Of Recommendation, 5 Days A Week"
2025-09-27 21:50:05,Video Editing/Making,Krishna Yadav,Delhi,Immediately,"₹ 8,000 - 20,000 /month",6 Months,5 Oct' 25,Nothing,Not Specified,"Adobe Premiere Pro, Final Cut Pro, Video Editing, Video Making","Certificate, Flexible, Letter Of Recommendation"
2025-09-27 21:50:06,Fashion Design,BGS Clothing Co Pvt Ltd,Delhi,Immediately,"₹ 10,000 - 20,000 /month",3 Months,5 Oct' 25,Nothing,Not Specified,"Fashion Designing, Market Analysis, Sketch","Certificate, Flexible, Letter Of Recommendation"
2025-09-27 21:50:09,Sales and Marketing,MEDIA BUYINGS,Delhi,Immediately,"₹ 10,000 - 18,000 /month",6 Months,5 Oct' 25,Nothing,Not Specified,"MS-Excel, MS-PowerPoint","Certificate, Letter Of Recommendation"
2025-09-27 21:50:11,Video Editing/Making,Positive Vibez Brand Solution Private Limited,Noida,Immediately,"₹ 8,000 - 10,000 /month",6 Months,5 Oct' 25,Nothing,Not Specified,"Adobe Illustrator, Adobe Photoshop, Adobe Premiere Pro, Final Cut Pro, Video Editing, Video Making",Certificate
2025-09-27 21:50:13,CA Articleship,R. Subramanian & Co. LLP,Delhi,Immediately,"₹ 6,000 - 10,000 /month",24 Months,5 Oct' 25,Nothing,Not Specified,"Accounting, English Proficiency (Spoken), English Proficiency (Written), MS-Office, Problem Solving, Statutory compliances, Time Management",Not Available
2025-09-27 21:50:15,Search Engine Optimization (SEO),SAURABH  MANCHANDA,West,Immediately,"₹ 8,000 - 12,000 /month",2 Months,5 Oct' 25,Nothing,Not Specified,"Digital Marketing, English Proficiency (Written), Google AdWords, Google Analytics, PHP, Search Engine Marketing (SEM), Search Engine Optimization (SEO), Social Media Marketing","Letter Of Recommendation, 5 Days A Week"
2025-09-27 21:50:17,Human Resources (HR),Pace HR Consulting LLP,Faridabad,Immediately,"₹ 5,000 - 8,000 /month",3 Months,5 Oct' 25,Nothing,Not Specified,"English Proficiency (Spoken), English Proficiency (Written), MS-Office, Recruitment","Certificate, Letter Of Recommendation, 5 Days A Week"
2025-09-27 21:50:19,Influencer Marketing,Snack Media,Delhi,Immediately,"₹ 5,000 - 10,000 /month",2 Months,5 Oct' 25,Nothing,"2. Pursuing or has completed a Bachelor's/Master's in Marketing, Mass Communication, or a related field","Effective Communication, Influencer Marketing, MS-Excel, Time Management","Certificate, Letter Of Recommendation"
2025-09-27 21:50:21,Social Media Marketing,La Polo,South,Immediately,"₹ 10,000 - 20,000 /month",6 Months,5 Oct' 25,Nothing,Not Specified,"English Proficiency (Spoken), Facebook Marketing, Instagram Marketing, Search Engine Optimization (SEO), Social Media Marketing","Certificate, Flexible, Letter Of Recommendation"
2025-09-27 21:50:23,Electronics Engineering,ChargOps Systems Private Limited,Jaipur,2. can start the internship between 13th Oct'25 and 12th Nov'25,"₹ 7,000 - 15,000 /month",6 Months,13 Oct - 12 Nov' 25,Nothing,Not Specified,"Analog Circuits, Circuit Design, PCB Design, Physics","Certificate, Flexible, Letter Of Recommendation, 5 Days A Week"
2025-09-27 21:50:25,Nothing,Nothing,Not Available,Not Available,Not Available,Not Available,Not Available,Nothing,Not Specified,Not Available,Not Available
2025-09-27 21:50:25,Mechanical Engineering,ChargOps Systems Private Limited,Jaipur,2. can start the internship between 13th Oct'25 and 12th Nov'25,"₹ 7,000 - 15,000 /month",2 Months,13 Oct - 12 Nov' 25,Nothing,Not Specified,"ANSYS, AutoCAD, Catia, MS-Office, SolidWorks","Certificate, Flexible, Letter Of Recommendation, 5 Days A Week"
2025-09-27 21:50:29,Social Media Marketing,Sakshi Gupta,Delhi,Immediately,"₹ 20,000 - 30,000 /month",3 Months,5 Oct' 25,Nothing,Not Specified,"English Proficiency (Spoken), English Proficiency (Written), Instagram Marketing","Certificate, Letter Of Recommendation"
2025-09-27 21:50:31,Video Editing/Making,Wedding Asia,South,Immediately,"₹ 10,000 - 20,000 /month",6 Months,5 Oct' 25,Nothing,Not Specified,"Adobe Illustrator, Adobe Photoshop, Adobe Premiere Pro, Final Cut Pro, Video Editing, Video Making","Certificate, Flexible, Letter Of Recommendation, 5 Days A Week"
2025-09-27 21:50:33,Fashion Design,Ankit V Kapoor World,Gurgaon,Immediately,"₹ 6,000 - 9,000 /month",3 Months,5 Oct' 25,Nothing,Not Specified,Fashion Designing,"Certificate, Letter Of Recommendation"
2025-09-27 21:50:36,Media & Public Relations (PR),Vaanii Gupta,Gurgaon,Immediately,"₹ 5,000 - 6,000 /month",3 Months,5 Oct' 25,Nothing,Not Specified,"Branding, Creative Writing, Social Media Marketing","Certificate, Flexible, Letter Of Recommendation"
2025-09-27 21:50:38,"Business Operations  (HR, Marketing, Finance)",IntelliSQR,Faridabad,Immediately,"₹ 8,000 - 9,000 /month",3 Months,5 Oct' 25,Nothing,1. Candidate who have completed or are about to complete their BA/B.Com degree.,"Administrative Support, Effective Communication, Email Marketing, English Proficiency (Written), Invoice Processing","Certificate, Flexible, Letter Of Recommendation, 5 Days A Week"
2025-09-27 21:50:41,sales,Workzon Business Centre,Gurgaon,Immediately,"₹ 15,000 - 20,000 /month",3 Months,5 Oct' 25,Nothing,Not Specified,"Client Relationship Management (CRM), Effective Communication, English Proficiency (Spoken), MS-Excel, Prospecting, Sales Strategy",Not Available
2025-09-27 21:50:43,Sales and Marketing,Tenacious Techies,Coimbatore,Immediately,"₹ 30,000 - 70,000 /month",3 Months,5 Oct' 25,Nothing,Not Specified,Sales,"Certificate, Flexible, Letter Of Recommendation"
2025-09-27 21:50:45,Teaching,Scope For Change,Delhi,Immediately,"₹ 8,000 /month",6 Months,5 Oct' 25,Nothing,"1. Teach students up to 10th Standard at our Tilak Nagar/Chaukhandi Center from 3 PM to 7 PM, Monday to Saturday","English Proficiency (Spoken), English Proficiency (Written), Hindi Proficiency (Written), Mathematics, Teaching","Certificate, Flexible, Letter Of Recommendation"
2025-09-27 21:50:48,Marketing,Physio Slim Fit Wellness Center,Delhi,Immediately,"₹ 5,000 - 7,000 /month",1 Month,5 Oct' 25,Nothing,Not Specified,"Canva, Content Writing, Digital Marketing, English Proficiency (Spoken), Market research, Search Engine Marketing (SEM), Search Engine Optimization (SEO), Social Media Marketing","Certificate, Letter Of Recommendation"
2025-09-27 21:50:50,Video Editing/Making,Reliable Allied Services,Delhi,Immediately,"₹ 6,000 - 6,001 /month",6 Months,26 Oct' 25,Nothing,Not Specified,"Digital Marketing, English Proficiency (Spoken), Graphic Design, Video Editing","Certificate, Letter Of Recommendation, 5 Days A Week"
2025-09-27 21:50:52,Robotics,Bricks 4 Kidz,Delhi,Immediately,"₹ 2,710 - 2,811 /week",4 Months,5 Oct' 25,Nothing,"3.Planning, preparing, and delivering the lessons to all the students in the class","Artificial intelligence, C Programming, Python, Robotics","Flexible, Letter Of Recommendation"
2025-09-27 21:50:55,Business Development (Sales),Dawaiwala24,Gurgaon,Immediately,"₹ 7,000 - 15,000 /month",3 Months,5 Oct' 25,Nothing,Not Specified,"Effective Communication, Field Sales, Interpersonal skills, Problem Solving","Certificate, Flexible, Letter Of Recommendation, 5 Days A Week"
2025-09-27 21:50:57,Content and Social Media Marketing,URE Legal Advocates,Noida,Immediately,"₹ 2,000 /month",6 Months,5 Oct' 25,Nothing,2. Pursuing or Completed MBA (Marketing/Communications/Strategy) / BBA / Mass Communication,"ChatGPT, Instagram Marketing, LinkedIn Marketing","Certificate, Flexible, Letter Of Recommendation"
2025-09-27 21:51:00,Human Resources (HR),Stirring Minds,Delhi,Immediately,"₹ 5,000 - 8,000 /month",6 Months,5 Oct' 25,Nothing,Not Specified,"Human Resources, Recruitment, Talent Management","Certificate, Mentorship"
2025-09-27 21:51:02,Content Writing,URE Legal Advocates,Noida,Immediately,"₹ 2,000 /month",6 Months,5 Oct' 25,Nothing,Not Specified,"Blogging, Creative Writing, Digital Marketing, Search Engine Optimization (SEO), Social Media Marketing","Certificate, Flexible, Letter Of Recommendation"
2025-09-27 21:51:04,Content & E-Commerce Management,URE Legal Advocates,Noida,Immediately,"₹ 2,000 /month",6 Months,5 Oct' 25,Nothing,Not Specified,"Analytical Thinking, English Proficiency (Spoken), Google AdWords, MS-Excel","Certificate, Flexible, Letter Of Recommendation"
2025-09-27 21:51:06,Supply Chain & Logistics Operations,AVM Healthcare Products Private Limited,Delhi,Immediately,"₹ 15,000 - 20,000 /month",3 Months,5 Oct' 25,Nothing,Not Specified,"MS-Access, MS-Excel",Not Available
2025-09-27 21:51:08,Service Trainee,Weiss Technik India,Delhi,Immediately,"₹ 16,000 - 18,500 /month",6 Months,5 Oct' 25,Nothing,1. Degree or Diploma from a reputed institution in engineering preferably in Electronics / Mechanical / Electrical.,"Electrical Machines, English Proficiency (Spoken), Mechanical & Electrical Product Design, MS-Excel, MS-Office","Certificate, Letter Of Recommendation, 5 Days A Week"
2025-09-27 21:51:11,Graphic Design,KiE Square Analytics,Noida,Immediately,"₹ 10,000 - 12,000 /month",3 Months,16 Oct' 25,Nothing,"1. Bachelor’s degree or diploma in graphic design, visual arts, multimedia, or a related field.","Adobe Illustrator, Adobe Photoshop, UI & UX Design, Video Editing","Certificate, Flexible, Letter Of Recommendation"
2025-09-27 21:51:13,"Prosthetics, Orthotics, And Podiatry (BPO/MPO)",Ambrosia Botanical,Gurgaon,Immediately,"₹ 5,000 - 12,000 /month",3 Months,5 Oct' 25,Nothing,Not Specified,"Effective Communication, English Proficiency (Spoken), English Proficiency (Written)","Certificate, Letter Of Recommendation"
2025-09-27 21:51:14,Field Sales,Ceramicapp Pvt Ltd,Chennai,Immediately,"₹ 10,000 /month",6 Months,5 Oct' 25,Nothing,Not Specified,"Effective Communication, English Proficiency (Spoken), Hindi Proficiency (Spoken), Interpersonal skills","Certificate, Flexible, Letter Of Recommendation"
2025-09-27 21:51:17,Social Media Marketing,FirstClaim Consultants Private Limited,Faridabad,2. can start the internship between 31st Oct'25 and 30th Nov'25,"₹ 3,000 - 16,000 /month",3 Months,31 Oct - 30 Nov' 25,Nothing,Not Specified,"Creative Writing, Digital Marketing, English Proficiency (Spoken), English Proficiency (Written), Facebook Marketing, Graphic Design, Instagram Marketing, Search Engine Marketing (SEM)","Certificate, Flexible"
2025-09-27 21:51:20,Graphic Design,Buffalo Soldiers,Noida,Immediately,"₹ 8,000 /month",6 Months,5 Oct' 25,Nothing,"1. Currently pursuing or recently completed a degree in graphic design, visual arts, or a related field.","Adobe Creative Suite, Adobe Illustrator, Adobe InDesign, Adobe Photoshop","Certificate, Mentorship, 5 Days A Week"
2025-09-27 21:51:22,Human Resources (HR),IG Drones,Bhubaneswar,Immediately,"₹ 6,000 - 12,000 /month",6 Months,5 Oct' 25,Nothing,1. MBA/PGDM/Graduate students in HR or Management (recent or final year),"English Proficiency (Spoken), English Proficiency (Written), MS-Excel, MS-Office","Certificate, Letter Of Recommendation, 5 Days A Week"
2025-09-27 21:51:24,Mechanical Engineering,AVM Healthcare Products Private Limited,Delhi,Immediately,"₹ 15,000 - 20,000 /month",3 Months,5 Oct' 25,Nothing,1. Bachelor's degree in mechanical engineering (master's preferred).,"Computer skills, MS-Excel, MS-Office",Not Available
2025-09-27 21:51:26,Executive Assistant – Lab & Documentation,Ambrosia Botanical,Gurgaon,Immediately,"₹ 5,000 - 12,000 /month",3 Months,5 Oct' 25,Nothing,1. Students or recent graduates (B.Sc Chemistry / B.Pharma preferred),"Document Management, Laboratory Techniques, Office Management, Organizational Development, Problem Solving, Time Management",Letter Of Recommendation
2025-09-27 21:51:28,Content and Social Media Marketing,Public Relations & Advocacy Group,Gurgaon,Immediately,"₹ 7,500 /month",3 Months,5 Oct' 25,Nothing,"1. Students and young professionals passionate about Africa-India relations, international affairs, cultural studies, research, and development cooperation","Client Relationship, Content Writing, Research and Analytics, Social Media Marketing","Certificate, Flexible, Letter Of Recommendation, 5 Days A Week"
2025-09-27 21:51:30,Graphic Design,ThreeTree Biotech Solutions,Ghaziabad,Immediately,"₹ 7,000 - 10,000 /month",3 Months,5 Oct' 25,Nothing,Not Specified,"Adobe Illustrator, Adobe Photoshop, Canva, Figma, Video Editing","Certificate, Flexible, Letter Of Recommendation"
2025-09-27 21:51:32,Influencer Marketing,Pixel Media,Delhi,Immediately,"₹ 5,000 - 10,000 /month",3 Months,5 Oct' 25,Nothing,Not Specified,"Influencer Marketing, Marketing, Marketing Campaigns","Certificate, Letter Of Recommendation"
2025-09-27 21:51:36,Recruitment,WORKWAVE GLOBAL,Delhi,Immediately,"₹ 2,500 - 13,500 /month",3 Months,5 Oct' 25,Nothing,Not Specified,"Cold Calling, English Proficiency (Spoken), MS-Excel, MS-Office",Certificate
2025-09-27 21:51:39,Social Media Marketing,Content Masters,Delhi,Immediately,"₹ 10,000 - 15,000 /month",6 Months,5 Oct' 25,Nothing,Not Specified,"Digital Marketing, English Proficiency (Spoken), English Proficiency (Written), Social Media Marketing",Letter Of Recommendation
2025-09-27 21:51:40,Dietetics/Nutrition,Dr Rajat Goel,Delhi,Immediately,"₹ 15,000 - 25,000 /month",3 Months,5 Oct' 25,Nothing,Not Specified,Dietetics/Nutrition,"Certificate, Flexible, Letter Of Recommendation"
2025-09-27 21:51:42,Business Development (Sales),4x4 Advisory Services Private Limited,Noida,Immediately,"₹ 12,000 - 15,000 /month",6 Months,5 Oct' 25,Nothing,Not Specified,"Client Relationship Management (CRM), Marketing Strategies, Market research, MS-PowerPoint","Certificate, 5 Days A Week"
2025-09-27 21:51:44,Service Engineer,Srishty Medical Pvt Ltd,Coimbatore,Immediately,"₹ 8,000 - 12,000 /month",6 Months,5 Oct' 25,Nothing,"4. are from Coimbatore, Delhi, Pune, Mumbai, Bangalore only",Analytical Thinking,Certificate
2025-09-27 21:51:47,Video Editing/Making,ANK Digital Media,Delhi,Immediately,"₹ 8,000 - 12,000 /month",6 Months,5 Oct' 25,Nothing,Not Specified,"Adobe After Effects, Adobe Creative Suite, Adobe Illustrator, Adobe Photoshop, Adobe Premiere Pro, CorelDRAW, Creative Thinking, Design Thinking",Certificate
2025-09-27 21:51:48,Instrumentation and Control Engineering,AVM Healthcare Products Private Limited,Delhi,Immediately,"₹ 5,000 - 10,000 /month",6 Months,5 Oct' 25,Nothing,1. Bachelor's degree in mechanical engineering (master's preferred).,"Computer skills, Mechanical & Electrical Product Design",Not Available
2025-09-27 21:51:50,Information Technology,AVM Healthcare Products Private Limited,Faridabad,Immediately,"₹ 15,000 - 20,000 /month",6 Months,5 Oct' 25,Nothing,Not Specified,"MS-Excel, MS-Office",Not Available
2025-09-27 21:51:52,Back Office,AVM Healthcare Products Private Limited,Faridabad,Immediately,"₹ 15,000 - 20,000 /month",6 Months,5 Oct' 25,Nothing,Not Specified,"Computer Vision, MS-Excel, MS-Office, MS-PowerPoint",Not Available
2025-09-27 21:51:53,Sales Executive,AVM Healthcare Products Private Limited,Delhi,Immediately,"₹ 15,000 - 20,000 /month",6 Months,5 Oct' 25,Nothing,Not Specified,"MS-Excel, MS-Office",Not Available
2025-09-27 21:51:55,Nothing,Nothing,Not Available,Not Available,Not Available,Not Available,Not Available,Nothing,Not Specified,Not Available,Not Available
2025-09-27 21:51:55,Field Sales,AVM Healthcare Products Private Limited,Delhi,Immediately,"₹ 5,000 - 15,000 /month",6 Months,5 Oct' 25,Nothing,Not Specified,"Computer skills, MS-Excel, MS-Word",Not Available
2025-09-27 21:51:57,Inside Sales,AVM Healthcare Products Private Limited,Faridabad,Immediately,"₹ 5,000 - 10,000 /month",5 Months,5 Oct' 25,Nothing,Not Specified,"Data entry, Marketing, Sales",Not Available
2025-09-27 21:51:59,HR Admin,AVM Healthcare Products Private Limited,Delhi,Immediately,"₹ 15,000 - 20,000 /month",6 Months,5 Oct' 25,Nothing,Not Specified,"MS-Access, MS-Excel, MS-Word",Not Available
2025-09-27 21:52:01,Data Entry,AVM Healthcare Products Private Limited,Delhi,Immediately,"₹ 12,000 - 20,000 /month",6 Months,5 Oct' 25,Nothing,Not Specified,"BASIC, Computer skills, Data Analytics, MS-Excel, MS-Office","Certificate, Letter Of Recommendation"
2025-09-27 21:52:02,Astrology Expert,ConversAIlabs,Delhi,Immediately,"₹ 10,000 - 10,001 /month",3 Months,5 Oct' 25,Nothing,Not Specified,Hindi Proficiency (Spoken),Not Available
2025-09-27 21:52:04,Content Writing,Indika AI Private Limited,Delhi,Immediately,"₹ 8,000 - 12,000 /month",6 Months,5 Oct' 25,Nothing,1. Candidates pursuing or graduated in Civil Engineering,"Creative Writing, English Proficiency (Spoken), English Proficiency (Written), Search Engine Optimization (SEO)","Certificate, 5 Days A Week"
2025-09-27 21:52:06,Business Development (Sales),TrackMyGrowth,Delhi,Immediately,"₹ 3,000 - 65,000 /month",6 Months,20 Oct' 25,Nothing,"3. Explaining the student-focused paid service, where TrackMyGrowth experts conduct monthly panel reviews covering each child's:","Digital Marketing, Email Marketing, English Proficiency (Spoken), Field Sales, Social Media Marketing","Certificate, Flexible, Letter Of Recommendation"
2025-09-27 21:52:08,Sales and Marketing,IYCWorld SoftInfrastructure Private Limited,Noida,Immediately,"₹ 15,000 - 65,000 /month",3 Months,5 Oct' 25,Nothing,Not Specified,"Digital Marketing, Effective Communication, Interpersonal skills, Marketing, Sales Management, Sales Support, Social Media Marketing",Letter Of Recommendation
2025-09-27 21:52:10,Biology,Bright Futures,Delhi,Immediately,"₹ 5,000 - 6,000 /month",6 Months,5 Oct' 25,Nothing,1. Assist in developing and implementing engaging Biology lesson plans for students,"Biology, Leadership, Teaching, Team Management, Teamwork","Certificate, Flexible, Letter Of Recommendation"
2025-09-27 21:52:12,Legal Research,URE Legal Advocates,Noida,Immediately,"₹ 2,000 /month",6 Months,5 Oct' 25,Nothing,Not Specified,"ChatGPT, CMS (Content Management System), Consulting, Content Editing, English Proficiency (Spoken), MS-Word","Certificate, Flexible, Letter Of Recommendation"
2025-09-27 21:52:14,Video Editing/Making,Careerx Counsellingzen (OPC) Private Limited (CareerBanao),Noida,Immediately,"₹ 5,000 - 10,000 /month",6 Months,5 Oct' 25,Nothing,Not Specified,"Adobe Illustrator, Adobe Photoshop, Adobe Premiere Pro, Final Cut Pro, Video Editing, Video Making","Certificate, Flexible, Letter Of Recommendation, 5 Days A Week"
2025-09-27 21:52:16,Search Engine Optimization (SEO),Etherea Essentia,Gurgaon,Immediately,"₹ 8,000 - 12,000 /month",3 Months,4 Oct' 25,Nothing,"1. Candidates from BBA, MBA, B.Com., Mass Comm, or any digital marketing-related field","Advanced Excel, Content Marketing, Digital Marketing, English Proficiency (Written), Google AdWords, Google Analytics, MS-Excel, Search Engine Marketing (SEM)","Certificate, Letter Of Recommendation"
2025-09-27 21:52:18,Digital Marketing,Etherea Essentia,Gurgaon,Immediately,"₹ 8,000 - 12,000 /month",3 Months,4 Oct' 25,Nothing,"1. Candidates from BBA, MBA,or any relevant digital marketing background.","Advanced Excel, Digital Marketing, E-commerce, Email Marketing, English Proficiency (Spoken), English Proficiency (Written), Facebook Marketing, Google Analytics","Certificate, Letter Of Recommendation"
2025-09-27 21:52:20,Client/Partner Engagement & Insights,Sambodhi,Noida,Immediately,"₹ 10,000 - 15,000 /month",6 Months,4 Oct' 25,Nothing,Not Specified,"Interpersonal skills, Report Writing","Certificate, 5 Days A Week"
2025-09-27 21:52:22,Architecture,Urban Oeuvre Designs,Delhi,Immediately,"₹ 8,000 - 12,000 /month",6 Months,4 Oct' 25,Nothing,Not Specified,"Adobe Photoshop, AutoCAD, Design Thinking, Google SketchUp, MS-Office, Sketching","Certificate, Letter Of Recommendation, 5 Days A Week"
2025-09-27 21:52:26,Apparel Merchandising,Creatnet Services Limited,Delhi,Immediately,"₹ 5,000 - 8,000 /month",3 Months,4 Oct' 25,Nothing,Not Specified,"MS-Excel, MS-PowerPoint, Operations","Certificate, Letter Of Recommendation"
2025-09-27 21:52:28,Company Secretary (CS),EstartIndia Private Limited,Delhi,Immediately,"₹ 8,000 - 10,000 /month",24 Months,4 Oct' 25,Nothing,Not Specified,"Accounting, English Proficiency (Spoken), English Proficiency (Written), MS-Office, MS-Word","Certificate, Flexible, Letter Of Recommendation, Mentorship"
2025-09-27 21:52:32,Social Media Marketing,Losung360,Gurgaon,Immediately,"₹ 18,000 - 20,000 /month",6 Months,4 Oct' 25,Nothing,Not Specified,"Canva, Digital Marketing, Instagram Marketing, Marketing Campaigns, Social Media Marketing",Not Available
