Date Time,profile,company,Location,Start Date,Stipend,Duration,Apply by Date,Offer,Education,Skills,Perks
2025-09-27 22:08:51,sales,KAMLA MINERALS,Hyderabad,Immediately,"₹ 15,000 - 16,000 /month",6 Months,10 Oct' 25,Nothing,Not Specified,"Effective Communication, Sales, Sales Management","Certificate, Letter Of Recommendation"
2025-09-27 22:08:52,Business Operations,Ascent HR,Gurgaon,Immediately,"₹ 15,000 - 18,000 /month",6 Months,3 Oct' 25,Nothing,1. Preferring ONLY BA/BCOM/BBA/BBM/BSC graduates can apply (Not Preferring pursuing candidates),"Effective Communication, MS-Excel","Certificate, Flexible, 5 Days A Week"
2025-09-27 22:08:54,Business Development (Sales),Nilah Retail Private Limited,Hyderabad,Immediately,"₹ 16,000 - 65,000 /month",3 Months,25 Oct' 25,Nothing,Not Specified,"Email Marketing, English Proficiency (Spoken), English Proficiency (Written), MS-Excel, Social Media Marketing","Certificate, Letter Of Recommendation, Mentorship, 5 Days A Week"
2025-09-27 22:08:56,Data Entry,Calipers Consulting Private Limited,Secunderabad,Immediately,"₹ 20,000 /month",1 Month,24 Oct' 25,Nothing,Not Specified,"Data entry, English Proficiency (Spoken), English Proficiency (Written), MS-Excel, MS-Office",Not Available
2025-09-27 22:08:58,Data Entry,Calipers Consulting Private Limited,Secunderabad,Immediately,"₹ 30,000 /month",1 Month,24 Oct' 25,Nothing,Not Specified,"English Proficiency (Spoken), English Proficiency (Written), MS-Excel, MS-Office",Not Available
2025-09-27 22:09:00,Data Entry,Faiyaz Brothers,Secunderabad,Immediately,"₹ 30,000 /month",1 Month,24 Oct' 25,Nothing,Not Specified,"Data entry, English Proficiency (Spoken), English Proficiency (Written), MS-Excel, MS-Office","Certificate, Flexible, Letter Of Recommendation, 5 Days A Week"
2025-09-27 22:09:02,Inside Sales,Kraf Ventures,Pune,Immediately,"₹ 10,000 - 17,000 /month",3 Months,24 Oct' 25,Nothing,Not Specified,"Effective Communication, MS-Excel, Presentation skills","Certificate, Flexible, Letter Of Recommendation"
2025-09-27 22:09:04,Back-office,Faiyaz Brothers,Hyderabad,Immediately,"₹ 50,000 /month",1 Month,25 Oct' 25,Nothing,Not Specified,"Data entry, English Proficiency (Spoken), English Proficiency (Written), MS-Excel, MS-Office","Certificate, Flexible, Letter Of Recommendation, 5 Days A Week"
2025-09-27 22:09:06,Business Development Executive,FixityEDX,Hyderabad,Immediately,"₹ 15,000 /month",6 Months,26 Oct' 25,Nothing,"2. Lead Generation & Conversion: Identify, approach, and convert potential students into enrolled learners through field visits and consistent follow-ups.","Field Sales, Interpersonal skills, Sales Management","Certificate, Flexible, 5 Days A Week"
2025-09-27 22:09:10,.NET Development,COEPD (Center Of Excellence For Professional Development),Hyderabad,Immediately,"₹ 4,000 - 6,000 /month",6 Months,26 Oct' 25,Nothing,1. Pursuing candidates are eligible,"ASP.NET, CSS, HTML, JavaScript, Model View Controller(MVC), MS SQL Server","Certificate, Flexible, Letter Of Recommendation"
2025-09-27 22:09:12,Nothing,Nothing,Not Available,Not Available,Not Available,Not Available,Not Available,Nothing,Not Specified,Not Available,Not Available
2025-09-27 22:09:12,Quality Analyst,Techdome Solutions Private Limited,Indore,Immediately,"₹ 10,000 - 15,000 /month",3 Months,24 Oct' 25,Nothing,Not Specified,"Agile Methodology, Automation, Jira, Manual Testing, Performance Testing, TestNG, WebDriver","Certificate, Flexible, Letter Of Recommendation, 5 Days A Week"
2025-09-27 22:09:14,AWS DevOps Engineer,Techdome Solutions Private Limited,Indore,Immediately,"₹ 5,000 /month",3 Months,24 Oct' 25,Nothing,Not Specified,"Ansible, CI/CD, Jenkins, Kubernetes, Linux, Object Oriented Programming (OOP), Software Development Life Cycle (SDLC)","Certificate, Flexible, Letter Of Recommendation, 5 Days A Week"
2025-09-27 22:09:16,Business Development (Sales),Zopper,Hyderabad,Immediately,"₹ 12,000 - 22,000 /month",6 Months,26 Oct' 25,Nothing,1. Any kind of degree will work as long as the person is street smart,"Client Relationship, Sales Management, Sales Strategy","Certificate, Flexible, Letter Of Recommendation, 5 Days A Week"
2025-09-27 22:09:17,Biomedical,Value Kare Healthtech LLP,Pune,Immediately,"₹ 5,000 - 10,000 /month",3 Months,26 Oct' 25,Nothing,Not Specified,"Advanced Excel, Automation, Canva, Data Analysis, MS-PowerPoint, Power BI","Certificate, Letter Of Recommendation"
2025-09-27 22:09:19,Agri Business Management Internship,The Affordable Organic Store,Hyderabad,Immediately,"₹ 8,000 /month",6 Months,5 Oct' 25,Nothing,Not Specified,"MS-Office, Operations, Problem Solving","Certificate, Letter Of Recommendation"
2025-09-27 22:09:21,Event Management,Ingenium World School,Hyderabad,Immediately,"₹ 20,000 - 55,000 /month",5 Months,18 Oct' 25,Nothing,Not Specified,"English Proficiency (Spoken), English Proficiency (Written), Event Management, MS-Excel, MS-Office, MS-PowerPoint","Certificate, Letter Of Recommendation"
2025-09-27 22:09:23,Telecalling,Educase India,Hyderabad,Immediately,"₹ 15,000 /month",4 Months,25 Oct' 25,Nothing,Not Specified,"Effective Communication, English Proficiency (Spoken), Hindi Proficiency (Spoken), Interpersonal skills","Certificate, Letter Of Recommendation"
2025-09-27 22:09:25,Social Media Marketing,Visys Cloud Technologies India Private Limited,Hyderabad,Immediately,"₹ 8,000 - 12,000 /month",3 Months,18 Oct' 25,Nothing,Not Specified,"Digital Advertising, Digital Marketing, Email Marketing, Google AdWords, Google Search Console, Lead Generation, Search Engine Marketing (SEM), Search Engine Optimization (SEO)","Certificate, Letter Of Recommendation"
2025-09-27 22:09:28,Fundraising,Roshani Beg,Chandigarh,Immediately,"₹ 10,500 - 15,500 /month",3 Months,26 Oct' 25,Nothing,1. Students from any stream/discipline can apply,English Proficiency (Spoken),"Certificate, Flexible, Letter Of Recommendation"
2025-09-27 22:09:30,sales,Infotrends Software Solutions Private Limited,Hyderabad,Immediately,"₹ 7,500 - 15,000 /month",6 Months,16 Oct' 25,Nothing,Not Specified,"Effective Communication, Field Sales, Field Work, Sales","Certificate, Letter Of Recommendation, 5 Days A Week"
2025-09-27 22:09:34,Sales and Marketing,IACG MULTI MEDIA,Hyderabad,Immediately,"₹ 35,000 - 1,18,000 /month",3 Months,24 Oct' 25,Nothing,2. Plan and execute field campaigns to generate student inquiries and admissions.,"Effective Communication, Public Relations, Public Speaking, Sales Strategy","Certificate, Letter Of Recommendation"
2025-09-27 22:09:36,Marketing,WeMakeScholars,Mangalore,Immediately,"₹ 6,000 - 16,000 /month",2 Months,25 Oct' 25,Nothing,1. Make the students aware about the Higher Education Scholarship Test - HEST using by implementing the activities shared by the team.,"Computer Networking, Effective Communication, Facebook Marketing, Instagram Marketing, Interpersonal skills","Certificate, Flexible, Letter Of Recommendation"
2025-09-27 22:09:38,Business Development (Sales),Techdome Solutions Private Limited,Indore,Immediately,"₹ 6,000 - 12,000 /month",3 Months,24 Oct' 25,Nothing,Not Specified,"Digital Marketing, Email Marketing, English Proficiency (Spoken), English Proficiency (Written), MS-Excel, Social Media Marketing","Certificate, Flexible, Letter Of Recommendation, 5 Days A Week"
2025-09-27 22:09:40,Human Resources (HR),Techdome Solutions Private Limited,Indore,Immediately,"₹ 5,000 - 10,000 /month",3 Months,24 Oct' 25,Nothing,"1. Pursuing or recently completed a degree in Human Resources, Business Administration, or a related field.","Effective Communication, Employment engagement, English Proficiency (Written), HR Operations, HR Policies, MS-Excel, MS-Office, MS-Word","Certificate, Flexible, 5 Days A Week"
2025-09-27 22:09:42,Graphic Design,Zeos India Private Limited,Hyderabad,Immediately,"₹ 15,000 /month",3 Months,15 Oct' 25,Nothing,Not Specified,"Adobe After Effects, Adobe Illustrator, Adobe Photoshop","Certificate, Letter Of Recommendation, 5 Days A Week"
2025-09-27 22:09:45,Hospital Audit,Value Kare Healthtech LLP,Pune,Immediately,"₹ 5,000 - 10,000 /month",3 Months,26 Oct' 25,Nothing,2. Preference will be given to candidates pursuing or holding an MBA or MHA,"Advanced Excel, Auditing, Canva, Data entry, Data Interpretation, Medical Coding, Medical Terminology, MS-PowerPoint","Certificate, Letter Of Recommendation"
2025-09-27 22:09:48,Business Development (Sales),Megaminds IT Services,Hyderabad,Immediately,"₹ 10,000 - 19,000 /month",6 Months,24 Oct' 25,Nothing,Not Specified,"Canva, Content Marketing, Design Thinking, Digital Marketing, Email Marketing, English Proficiency (Spoken), English Proficiency (Written), MS-Excel","Certificate, Flexible, Letter Of Recommendation"
2025-09-27 22:09:50,Architecture,Tisteps Private Limited,Chennai,Immediately,"₹ 30,000 - 40,000 /month",6 Months,5 Nov' 25,Nothing,Not Specified,"Adobe Photoshop, AutoCAD, Autodesk Revit, MS-Office","Certificate, Flexible, Letter Of Recommendation, 5 Days A Week"
2025-09-27 22:09:52,Store Fashion Consultant,Tomorrowland Apparels Private Limited,Hyderabad,Immediately,"₹ 9,000 - 10,000 /month",3 Months,24 Oct' 25,Nothing,Not Specified,Fashion Styling,Not Available
2025-09-27 22:09:53,Event Management,Events By Leahwaan,Hyderabad,Immediately,"₹ 6,000 - 12,000 /month",4 Months,22 Oct' 25,Nothing,Not Specified,"AutoCAD, Client Interaction, Creative Thinking, Design Thinking, Event Management, Vendor Management",Not Available
2025-09-27 22:09:55,Promoter,WeMakeScholars,Mangalore,Immediately,"₹ 6,000 - 14,000 /month",2 Months,25 Oct' 25,Nothing,3. Target students who are considering studying overseas.,"Digital Marketing, Effective Communication, Networking","Certificate, Flexible, Letter Of Recommendation"
2025-09-27 22:09:59,Operations,Bon Appétit Cafe,Hyderabad,Immediately,"₹ 3,000 - 5,000 /month",6 Months,22 Oct' 25,Nothing,Not Specified,"English Proficiency (Spoken), English Proficiency (Written), MS-Excel, MS-Word","Certificate, Letter Of Recommendation"
2025-09-27 22:10:01,Video Editing/Making,Silverlabs India Private Limited,Hyderabad,Immediately,"₹ 15,300 - 18,300 /month",6 Months,22 Oct' 25,Nothing,Not Specified,"Adobe Illustrator, Adobe Photoshop, Adobe Premiere Pro, Canva, Capcut, Final Cut Pro, Video Editing, Video Making","Certificate, Flexible, 5 Days A Week"
2025-09-27 22:10:04,Inside Sales,ReelOn Technologies Pvt. Ltd,Hyderabad,Immediately,"₹ 5,000 - 10,000 /month",6 Months,17 Oct' 25,Nothing,1. Education: No formal degree required (basic education is sufficient).,"English Proficiency (Spoken), Hindi Proficiency (Spoken), Kannada Proficiency (Spoken)","Certificate, Flexible"
2025-09-27 22:10:08,Marketing,WEXA AI,Hyderabad,Immediately,"₹ 8,000 - 10,000 /month",6 Months,22 Oct' 25,Nothing,Not Specified,"Blogging, Content Editing, Content Writing, Digital Marketing, Email Marketing, English Proficiency (Written), Graphic Design, Social Media Marketing","Certificate, Letter Of Recommendation, 5 Days A Week"
2025-09-27 22:10:10,Campus Ambassador,JK Shah Classes,Ahmedabad,Immediately,Not Available,2 Months,23 Oct' 25,Nothing,"1. ACCA Awareness & Outreach: Identify and connect with commerce and undergraduate students (B.Com, BAF, BMS, etc.) across your campus and network who may be interested in global accounting careers, introducing them to the ACCA course offered by JK Shah Classes.","Client Relationship, Effective Communication, English Proficiency (Spoken), Marketing, Negotiation, Problem Solving","Certificate, Flexible, Letter Of Recommendation"
2025-09-27 22:10:12,Field Sales,Global Edutech,Hyderabad,Immediately,"₹ 7,500 - 15,000 /month",3 Months,10 Oct' 25,Nothing,"1. Pursuing/completed a Bachelor's degree in Business, Marketing, or any related field.","Client Relationship Management (CRM), Customer Acquisition, Effective Communication, English Proficiency (Spoken), Hindi Proficiency (Spoken), Marketing, Market research, Research and Analytics","Certificate, Flexible, Letter Of Recommendation, Mentorship"
2025-09-27 22:10:13,Event Management,EduAce Services,Chennai,Immediately,"₹ 5,000 - 10,000 /month",3 Months,22 Oct' 25,Nothing,Not Specified,"English Proficiency (Spoken), English Proficiency (Written), Event Management, MS-Excel","Certificate, Flexible, Letter Of Recommendation"
2025-09-27 22:10:15,Warehouse Operations Executive,The Affordable Organic Store,Hyderabad,Immediately,"₹ 8,000 /month",6 Months,5 Oct' 25,Nothing,Not Specified,"Effective Communication, MS-Excel, MS-Office, MS-PowerPoint, Problem Solving","Certificate, Letter Of Recommendation"
2025-09-27 22:10:18,Warehouse Operation,The Affordable Organic Store,Hyderabad,Immediately,"₹ 15,000 /month",6 Months,15 Oct' 25,Nothing,Not Specified,"Effective Communication, MS-Excel, MS-Office, MS-PowerPoint, Problem Solving","Certificate, Letter Of Recommendation"
2025-09-27 22:10:20,Inside Sales,NNIIT,Hyderabad,Immediately,"₹ 40,000 - 2,75,000 /month",6 Months,19 Oct' 25,Nothing,"1. Counsel parents and students on K9-K12 learning programs via calls, virtual meetings, or in-person interactions.",Salesforce,Letter Of Recommendation
2025-09-27 22:10:22,Telecalling,Ayathana Designs And Build Mart Pvt LTD,Hyderabad,Immediately,"₹ 15,000 /month",6 Months,18 Oct' 25,Nothing,Not Specified,Sales Support,"Certificate, Letter Of Recommendation"
2025-09-27 22:10:24,Video Editing/Making,MastersHelp,Secunderabad,Immediately,"₹ 10,500 - 16,000 /month",6 Months,2 Oct' 25,Nothing,Not Specified,"Capcut, Instagram Marketing, Time Management, Video Editing, Video Making","Certificate, Letter Of Recommendation"
2025-09-27 22:10:26,Human Resources (HR),SYKAM ASSETS MANAGEMENT (OPC) PRIVATE LIMITED,Hyderabad,Immediately,"₹ 5,000 - 8,000 /month",2 Months,20 Oct' 25,Nothing,2. BBA or MBA - pursuing/pursued (HR - domain preferred).,"Attendance Management, Decision making, Document Management, Effective Communication, English Proficiency (Spoken), English Proficiency (Written), HR Analytics",Flexible
2025-09-27 22:10:28,Talent Acquisition,SYKAM ASSETS MANAGEMENT (OPC) PRIVATE LIMITED,Hyderabad,Immediately,"₹ 5,000 - 8,000 /month",2 Months,20 Oct' 25,Nothing,1. BBA or MBA (Completed or Pursuing) Preferred - HR domain,"Attendance Management, Attention to Detail, Document Management, Effective Communication, Employee Relations, Employment engagement, English Proficiency (Spoken), English Proficiency (Written)",Flexible
2025-09-27 22:10:30,Business Development (Sales),Fission Infotech,Hyderabad,Immediately,"₹ 8,000 - 10,000 /month",3 Months,15 Oct' 25,Nothing,"1. Students or recent graduates from Engineering, Business, Math, or Economics","Business Development, Client Interaction, Critical thinking, Effective Communication, Networking, Problem Solving, Research and Analytics, Sales","Certificate, Flexible, Letter Of Recommendation, Mentorship, 5 Days A Week"
2025-09-27 22:10:32,Social Media,Humann,Hyderabad,Immediately,"₹ 12,000 /month",3 Months,5 Oct' 25,Nothing,Not Specified,"Canva, Content Editing, Creative Direction, Instagram Marketing, LinkedIn Marketing, Script Writing, Social Media Marketing, Video Editing","Certificate, Letter Of Recommendation"
2025-09-27 22:10:34,Purchase & Admin,UNIO Labs,Secunderabad,Immediately,"₹ 5,000 - 9,000 /month",3 Months,17 Oct' 25,Nothing,Not Specified,"Client Interaction, Customer Support, Effective Communication, Email Management, Human Resources, Interpersonal skills, Microsoft 365, MS-Excel","Certificate, Flexible, Letter Of Recommendation"
2025-09-27 22:10:36,Inside Sales,Visys Cloud Technologies India Private Limited,Hyderabad,Immediately,"₹ 8,000 - 23,000 /month",6 Months,11 Oct' 25,Nothing,Not Specified,"Business Development, Customer Acquisition, Inside Sales, Lead Generation, Marketing, Prospecting, Sales","Certificate, Letter Of Recommendation"
2025-09-27 22:10:38,Business Development (Sales),Visys Cloud Technologies India Private Limited,Hyderabad,Immediately,"₹ 13,000 - 17,000 /month",3 Months,10 Oct' 25,Nothing,Not Specified,"Customer Acquisition, English Proficiency (Spoken), Hindi Proficiency (Spoken), Inside Sales, Market Analysis, Marketing, Sales, Sales Management","Certificate, Letter Of Recommendation"
2025-09-27 22:10:41,Purchase & Admin,UNIO Labs,Secunderabad,Immediately,"₹ 5,000 - 9,000 /month",3 Months,17 Oct' 25,Nothing,Not Specified,"Client Interaction, Customer Support, Effective Communication, Email Management, Human Resources, Interpersonal skills, Microsoft 365, MS-Excel","Certificate, Flexible, Letter Of Recommendation"
2025-09-27 22:10:43,Inside Sales,Visys Cloud Technologies India Private Limited,Hyderabad,Immediately,"₹ 8,000 - 23,000 /month",6 Months,11 Oct' 25,Nothing,Not Specified,"Business Development, Customer Acquisition, Inside Sales, Lead Generation, Marketing, Prospecting, Sales","Certificate, Letter Of Recommendation"
2025-09-27 22:10:45,Business Development (Sales),Visys Cloud Technologies India Private Limited,Hyderabad,Immediately,"₹ 13,000 - 17,000 /month",3 Months,10 Oct' 25,Nothing,Not Specified,"Customer Acquisition, English Proficiency (Spoken), Hindi Proficiency (Spoken), Inside Sales, Market Analysis, Marketing, Sales, Sales Management","Certificate, Letter Of Recommendation"
2025-09-27 22:10:46,Digital Marketing,Visys Cloud Technologies India Private Limited,Hyderabad,Immediately,"₹ 3,000 - 5,000 /month",3 Months,10 Oct' 25,Nothing,"1. Bachelor’s degree in Marketing, Business, Communications, or related field.","Canva, Creative Writing, Digital Marketing, Facebook Ads, Facebook Marketing, Google AdWords, Instagram Marketing, Poster Design","Certificate, Letter Of Recommendation"
2025-09-27 22:10:48,Marketing,Visys Cloud Technologies India Private Limited,Hyderabad,Immediately,"₹ 6,000 - 20,000 /month",3 Months,8 Oct' 25,Nothing,"1. Pursuing or recently completed a degree in Marketing, Business Administration, or related fields.","Business Development, Customer Acquisition, Hindi Proficiency (Spoken), Inside Sales, Lead Generation, Prospecting","Certificate, Mentorship"
2025-09-27 22:10:50,Graphic Design,Visys Cloud Technologies India Private Limited,Hyderabad,Immediately,"₹ 5,000 - 7,000 /month",3 Months,17 Oct' 25,Nothing,Not Specified,"Adobe After Effects, Adobe Illustrator, Adobe Photoshop, Adobe Premiere Pro, Canva, CorelDRAW, Figma, Image Editing","Certificate, Letter Of Recommendation"
2025-09-27 22:10:52,Social Media Marketing,Omkar Billa,Hyderabad,Immediately,"₹ 2,000 - 2,001 /month",3 Months,2 Oct' 25,Nothing,Not Specified,"Canva, Effective Communication, Google Sheets, Interpersonal skills, Public Speaking, Sales Management, Social Media Marketing, Video Editing","Certificate, Flexible"
2025-09-27 22:10:53,Partnerships & Outreach,Caarya,Bhubaneswar,Immediately,"₹ 8,000 - 15,000 /month",2 Months,22 Oct' 25,Nothing,"1. Research and identify potential NGO, startup, and student venture partners.","Client Relationship Management (CRM), Cold Calling, Effective Communication, Email Marketing, English Proficiency (Spoken), Google Sheets, Hindi Proficiency (Spoken), Interpersonal skills","Certificate, Flexible, Letter Of Recommendation, Mentorship"
2025-09-27 22:10:55,Graphic Design,Nivara Diamonds Private Limited,Hyderabad,Immediately,"₹ 11,000 - 18,000 /month",3 Months,19 Oct' 25,Nothing,Not Specified,"Adobe Creative Suite, Adobe Illustrator, Adobe Photoshop, Adobe Premiere Pro, Canva, CorelDRAW, UI & UX Design","Certificate, Letter Of Recommendation"
2025-09-27 22:10:57,Business Development (Sales),Barsyl,Delhi,Immediately,"₹ 10,000 - 12,000 /month",2 Months,4 Oct' 25,Nothing,1. MBA (Marketing) students seeking practical exposure in marketing and promotions.,"Digital Marketing, Email Marketing, English Proficiency (Spoken), English Proficiency (Written), MS-Excel, Social Media Marketing",Certificate
2025-09-27 22:10:59,Nothing,Nothing,Not Available,Not Available,Not Available,Not Available,Not Available,Nothing,Not Specified,Not Available,Not Available
2025-09-27 22:10:59,Business Development (Sales),Rushh Deals,Hyderabad,Immediately,"₹ 15,000 - 20,000 /month",3 Months,27 Oct' 25,Nothing,Not Specified,"Digital Marketing, English Proficiency (Spoken), Field Sales, Hindi Proficiency (Spoken), Social Media Marketing, Telugu Proficiency (Spoken)","Letter Of Recommendation, 5 Days A Week"
2025-09-27 22:11:01,Fashion Consultant,Boldfuse,Hyderabad,Immediately,"₹ 8,000 /month",3 Months,27 Oct' 25,Nothing,Not Specified,"Fashion Designing, Fashion illustration, Fashion Styling",Certificate
2025-09-27 22:11:03,Accounting & Bookkeeping,Wynbee,Hyderabad,Immediately,"₹ 10,000 - 14,000 /month",3 Months,27 Oct' 25,Nothing,Not Specified,"Accounting, Zoho Books, Zoho CRM",Not Available
2025-09-27 22:11:05,Digital Marketing,Tiso Studio Private Limited,Hyderabad,Immediately,"₹ 2,000 /month",4 Months,26 Oct' 25,Nothing,Not Specified,"Digital Marketing, Search Engine Marketing (SEM), Search Engine Optimization (SEO)","Certificate, Letter Of Recommendation"
2025-09-27 22:11:08,Graphic Design,Sai Chaithra Foods,Hyderabad,Immediately,"₹ 3,000 - 10,000 /month",3 Months,26 Oct' 25,Nothing,Not Specified,"Adobe Animate, Adobe Illustrator, Adobe Photoshop, Animation, Autodesk 3ds Max, CorelDRAW","Certificate, Flexible, Letter Of Recommendation"
2025-09-27 22:11:10,Digital Marketing,Clientcarex AI Private Limited,Hyderabad,Immediately,"₹ 9,000 - 14,000 /month",6 Months,26 Oct' 25,Nothing,Not Specified,"Creative Writing, Search Engine Optimization (SEO), Social Media Marketing","Certificate, Flexible, Letter Of Recommendation, 5 Days A Week"
2025-09-27 22:11:13,Accounting & Bookkeeping,Advince LLP,Hyderabad,Immediately,"₹ 3,001 - 6,000 /month",6 Months,25 Oct' 25,Nothing,Not Specified,"Accounting, Taxation","Certificate, Flexible, Letter Of Recommendation"
2025-09-27 22:11:15,Creative (Filmmaking & Content),Vector Technics Pvt Ltd,Hyderabad,Immediately,"₹ 15,000 - 20,000 /month",6 Months,25 Oct' 25,Nothing,Not Specified,"Adobe Premiere Pro, Social Media Marketing, Videography","Certificate, Letter Of Recommendation, Mentorship"
2025-09-27 22:11:17,Graphic Design,Siddharthsai Events & Management Services Private Limited,Hyderabad,Immediately,"₹ 10,000 /month",6 Months,25 Oct' 25,Nothing,Not Specified,"Adobe Illustrator, Adobe Photoshop, CorelDRAW, UI & UX Design, Video Editing",Certificate
2025-09-27 22:11:19,Sales and Marketing,META SOURCE,Hyderabad,Immediately,"₹ 5,000 - 10,000 /month",3 Months,25 Oct' 25,Nothing,Not Specified,"Canva, Client Relationship Management (CRM), English Proficiency (Spoken), Lead Generation, Logistics Management, MS-Excel, Problem Solving, Team Management","Certificate, Flexible, Letter Of Recommendation"
2025-09-27 22:11:23,Cyber Security,Prime Infoserv LLP,Delhi,Immediately,"₹ 5,000 /month",3 Months,25 Oct' 25,Nothing,1. B.Tech with CEH/CHFI will be preferable,"Ethical Hacking, Java","Certificate, Letter Of Recommendation"
2025-09-27 22:11:25,Admission Support,The Gaudium,Hyderabad,Immediately,"₹ 14,000 - 15,000 /month",6 Months,25 Oct' 25,Nothing,"1. Communicate effectively with prospective students and families via phone, email, and in person",Effective Communication,Certificate
2025-09-27 22:11:28,Marketing Operations (3 Months),Qapita - CapTable & ESOP Management Platform,Hyderabad,Immediately,"₹ 15,000 - 25,000 /month",Marketing Operations (3 Months),25 Oct' 25,Nothing,Not Specified,"Client Relationship Management (CRM), Data Analysis, Lead Generation, Marketing Automation, Marketing Campaigns, MS-Excel","Certificate, Flexible, Letter Of Recommendation, 5 Days A Week"
2025-09-27 22:11:30,3D Artist,Imaginate Software Labs,Varanasi,Immediately,"₹ 5,000 - 10,000 /month",6 Months,25 Oct' 25,Nothing,Not Specified,"3D Modeling, Adobe Illustrator, Adobe Premiere Pro, Autodesk Maya, Blender 3D, Substance Painter","Certificate, Letter Of Recommendation, 5 Days A Week"
2025-09-27 22:11:31,Company Secretary (CS),Innopark India Private Limited,Hyderabad,Immediately,"₹ 15,000 /month",12 Months,25 Oct' 25,Nothing,Not Specified,"MS-Office, MS-Word","Certificate, 5 Days A Week"
2025-09-27 22:11:34,Project Management,Digital Pro Business Services Private Limited,Hyderabad,Immediately,"₹ 12,000 /month",6 Months,25 Oct' 25,Nothing,Not Specified,"Advanced Excel, Business Analysis, English Proficiency (Spoken), English Proficiency (Written), Jira, Telugu Proficiency (Spoken)","Certificate, Letter Of Recommendation"
2025-09-27 22:11:36,Business Development (Sales),ProDigit,Hyderabad,Immediately,"₹ 17,000 /month",6 Months,25 Oct' 25,Nothing,Not Specified,"English Proficiency (Spoken), English Proficiency (Written), Hindi Proficiency (Spoken), Telugu Proficiency (Spoken)","Certificate, Letter Of Recommendation"
2025-09-27 22:11:38,Relationship Trainee,Apvanam Solution,Delhi,Immediately,"₹ 10,700 - 17,000 /month",6 Months,25 Oct' 25,Nothing,Not Specified,"Effective Communication, Marketing, Sales, Time Management","Certificate, Letter Of Recommendation"
2025-09-27 22:11:40,Wealth Management,Bondbazaar,Delhi,Immediately,"₹ 5,000 - 12,500 /month",2 Months,25 Oct' 25,Nothing,Not Specified,"Effective Communication, Time Management","Certificate, Flexible, Letter Of Recommendation, 5 Days A Week"
2025-09-27 22:11:42,Field Sales,Index Studio Private Limited,Hyderabad,Immediately,"₹ 10,000 - 15,000 /month",6 Months,25 Oct' 25,Nothing,Not Specified,"Digital Marketing, English Proficiency (Spoken), Hindi Proficiency (Spoken), Lead Generation, Sales Strategy","Certificate, Letter Of Recommendation, 5 Days A Week"
2025-09-27 22:11:45,Hotel Management (Food & Beverage Production),The Gaudium,Hyderabad,Immediately,"₹ 14,000 - 15,000 /month",6 Months,25 Oct' 25,Nothing,1. Must be a Hotel management graduate and a fresher,"Interpersonal skills, MS-Excel",Not Available
